screen_name, location, created_at, description
LannnerZ,,Mon Mar 23 21:47:34 +0000 2009,I love enjoying great wine with good friends &/or total strangers. I tend to follow the delicious.
uprisingbreads,Vancouver,Mon Jan 24 14:11:02 +0000 2011,Baking tasty; whole grain; honey-sweetened bread & goodies for 35 yrs in Vancouver; BC. Two bakery/cafés: 1697 Venables & 3066 W Broadway www.uprisingbreads.com
VanObserver,Vancouver; BC,Sat Nov 15 18:15:22 +0000 2008,Journalism matters.
RobCottingham,Vancouver,Tue Oct 24 04:25:30 +0000 2006,Social media enabler (@socialsignal).  Noise to Signal cartoonist (@ntos). Humorist. Speaker.  Sweetie of @awsamuel.  Believer in the wide-open web.
bartdebaere,Vancouver/Europe,Tue Nov 25 04:30:23 +0000 2008,Geek. Yogi. Avid traveller. PhD student @UBCGradSchool. Volunteer @YouthCo. Lover of cute dogs and pain au chocolat snob. Favours hugs over handshakes.
iheartcities,Vancouver; BC,Wed Jun 17 18:55:53 +0000 2009,urban enthusiast; public engagement specialist; sustainability nerd; music lover & knitter. #publicengmt
stephenhui,Vancouver,Thu Jul 31 23:40:16 +0000 2008,Web editor and technology editor at the Georgia Straight. Email shui@straight.com. http://www.straight.com/
canadamais,Vancouver Canada,Thu Feb 23 05:09:24 +0000 2012,Estudar inglês em Vancouver / Canadá #intercambio - #studyabroad #vancouver #canada
TheCityonCiTR,Vancouver; Canada,Fri Feb 17 18:57:59 +0000 2012,The City; an urban affairs show on CiTR 101.9 FM in Vancouver; hosted and produced by Andy Longhurst. Tuesdays 5pm. Available in FM; web stream; and podcast.
andrewconsiders,Vancouver,Mon Jun 27 04:18:45 +0000 2011,
SafeHarbourCdn,Vancouver and B.C.,Fri Oct 24 17:05:53 +0000 2008,Creating welcoming & #inclusive communities for newcomers & all Canadians through #diversity workshops & #intercultural communication. 
dietersoetje,,Mon Jan 30 06:40:36 +0000 2012,
KarinaLanting,BC,Sat Apr 18 16:13:10 +0000 2009,owner/operator of Project K; an online based accessory company & popular lifestyle blog. Check out Project K's official Twitter account at @tweetprojectk. 
TerraBreads,Vancouver; BC,Sun Feb 01 03:33:49 +0000 2009,Terra Breads is a leader in artisan baking and fresh café products. We make true artisan breads using traditional methods developed over thousands of years. 
KurtisKolt,Vancouver,Sat Nov 01 22:08:45 +0000 2008,Vancouver Enthusiast! | Independent Wine Consultant & Writer | Guy About Town | Laptop Hobo | Optimist
darkbluewaters,Vancouver,Sun May 29 01:46:02 +0000 2011,Currently living near the ocean; thinking about education; social media; web design; things to do in Vancouver and other random thoughts.
jzerkee,Vancouver; BC; Canada,Mon Mar 28 21:56:39 +0000 2011,Mom. Archivist. Library clerk. List-maker extraordinaire. Cat person.
Mary_Augusto,Vancouver/Canadá,Sun Jan 10 15:05:50 +0000 2010,Brasileira vivendo em Vancouver; estudante de Ger de Projetos; formada em ADM; consultora de intercambio; apaixonada por fotografias e louca por viagens!!!
tracyrawa,,Thu Jan 22 16:28:47 +0000 2009,
RUNVAN_rdjordan,Vancouver; BC,Thu Dec 15 01:05:15 +0000 2011,Race Director | Vancouver International Marathon Society |   41st BMO Vancouver Marathon | May 6 2012 |  Cyclist w/ a running problem | Community Advocate 
LauraRienks,Vancouver; BC,Thu Oct 20 19:28:49 +0000 2011,SFU Environmental Science Graduate; avid traveler and figure skater.
aitakt,Vancouver; Canada,Thu Dec 29 19:37:45 +0000 2011,Passionate about the non-profit sector; philanthropy; and volunteering. Aspiring apiarist. Occasionally talks like a fortune cookie. 
RCCSYouth,Richmond; B.C.,Sun Oct 30 04:56:02 +0000 2011,R.C.C.S. created this youth group for local youths to meet new friends; and provide them with volunteering opportunities in their community. Come join the fun!
arwenhunter,Vancouver; Vancouver Island,Sun Oct 19 22:10:27 +0000 2008,filmmaker; foodie; dog person; sailor; hobo
jamievala,,Thu Nov 24 03:47:34 +0000 2011,landscape architect; park planner; biologist; passionate about creating urban environments with space for all creatures
ArtsFutureYVR,Vancouver; BC,Thu Oct 06 18:44:36 +0000 2011,A display and celebration of the Future of Community Arts in Vancouver - engaging with 12 partners who are involved with youth + community + art @ArtsCouncilYVR
frenchpressme,New Westminster BC,Sat Aug 29 16:46:12 +0000 2009,Loving #NewWest BC. Coffee Roaster @SS_Coffee. Promoting community; food; people; businesses; products & ideas. Contact me here or email: followforage@gmail.com
vanoccupied,Unceded Coast Salish Territory,Fri Oct 28 21:42:54 +0000 2011,
HRYao,vancouver,Sun Dec 12 05:57:34 +0000 2010,Academic advisor for Beedie School of Business by day; dancer of Argentine tango by night.  Lover of fresh markets & tasty food; collector of words and paper.
lindzmarsh,Vancouver;Coast Salish Land,Mon Feb 23 22:29:58 +0000 2009,#Sustainable community developer; #RRU #intercultural communication grad student; #diversity trainer; #queer activist in #Vancouver; lover of #haiku
FreshOutlook,Canada,Sat Oct 15 17:07:17 +0000 2011,The Foundation uses communication and collaboration tools to enable lasting behaviour changes that support social; environmental and economic sustainability. 
GECCoop,Maple Ridge/Pitt Meadows,Fri Mar 11 06:27:06 +0000 2011,Vision: to open a storefront Co-op for #mapleridge & #pittmeadows offering local products; helping to strengthen community and re-localize our economy. #GECCoop
VanSocialPolicy,Vancouver; BC,Tue Aug 23 20:47:41 +0000 2011,CoV Social Policy works to address critical social issues facing Vancouver: food security; immigration; child/youth/senior/family policy; urban health. 
W2Radio,DTES; Vancouver,Sat Oct 15 04:46:48 +0000 2011,Broadcasting in Vancouver at 102.7FM; Mon to Fri; 6 to 8am; streams http://www.coopradio.org/content/listen Get involved! radio@creativetechnology.org
sarenatalbot,Vancouver,Thu Feb 17 22:38:01 +0000 2011,Passionate about community. Committed to social change. Certified skipper. Education Program Assistant @CoDevCanada. Candidate Liaison @COPEVancouver.
PlaceSpeak,Vancouver,Sat Jan 08 01:07:43 +0000 2011,PlaceSpeak is a location-based consultation platform that connects citizens to local issues. Claim your place. Speak your mind. Most tweets from @YuriArtibise.
janet_see,Vancouver,Sat Nov 27 01:15:31 +0000 2010,Canucks fan; caffeine addict. 
devotedforlife,Vancouver; BC,Mon Jan 24 23:43:42 +0000 2011,Lover of food; cooking and outdoors. Check it out at http://foodandpassion.blogspot.com
angecullen,Vancouver; BC,Mon Dec 06 21:04:51 +0000 2010,You may regret following me. Just like Peter Mansbridge did.
geoffmeggs,Vancouver,Mon Mar 16 04:36:24 +0000 2009,Vancouver City Councillor; Metro Vancouver Director; cyclist; hiker and practitioner of idealistic pragmatism.
jcnarvey,Vancouver,Fri Sep 17 01:51:51 +0000 2010,a movie loving; foody student
WorldinaGarden,Vancouver; BC,Mon Mar 21 23:46:22 +0000 2011,Multicultural urban agriculture project that educates community and youth on the benefits of a just and local food system.    
DTESNHouse,Vancouver; BC,Fri Jul 01 06:26:10 +0000 2011,The grassroots and secular DTES Neighbourhood House was created by the residents of the downtown eastside; for the residents of the downtown eastside.
chanels2cents,Vancouver,Wed Mar 02 21:37:41 +0000 2011,On BoD of @SustainableSFU; chair of @SFULocalFood. sustainability; youth leadership; food security; urban ag; bikram yoga; art; social justice.
jawnbeary,Vancouver; British Columbia,Sat Nov 20 22:24:30 +0000 2010, I'm a Liberally-inclined political hack. In my spare time; I'm an IR major at UBC attempting to learn Mandarin. Opinions expressed here are not my own.
Sninkle_o,BC; Canada,Tue Jul 28 15:00:28 +0000 2009,Life is too short to not take chances. I am a geeky girl: play vid games; learning Japanese; like to break software & think it's fun to play with Excel & Access
aleksandrabrz,Vancouver; Canada,Tue Aug 03 05:34:36 +0000 2010,cities; music; wit; living room dancing; gin cocktails; travel; books; baking; crosswords; anything involving costumes.
jess_pan,Vancouver,Sat Jul 09 06:21:42 +0000 2011,#CommunityActionInitiative program coordinator; #UBC master of health administration candidate; @EHLVancouver events coordinator; recycler; dancer & foodie 
spacingvan,Vancouver; B.C.; Canada,Fri Jun 24 15:28:46 +0000 2011,Spacing Vancouver examines the joys; obstacles & politics of the urban landscape in B.C. @Spacing Canadian Magazine of the Year 2007-09.
sengsuriya,Vancouver; Canada,Sun Mar 22 03:53:10 +0000 2009,Interdisciplinary designer; trained in architecture. Maker of things and music. Winnipeg-grown flâneuse.
YuriArtibise,Vancouver; BC,Wed Aug 13 01:37:14 +0000 2008,I'm a policy analyst; blogger; urbanist & community manager who is re-discovering what #Vancouver has to offer. I also tweet for @PlaceSpeak and @SpacingVan
Viva_Van,Vancouver; BC,Tue Apr 19 20:56:35 +0000 2011, Imagine if you transformed popular Vancouver streets into public spaces that attracted people to spend more time on the street! That's Viva Vancouver!
diyyinah,Vancouver; CANADA █ ♥ █,Thu Mar 26 02:13:04 +0000 2009,[Diana]: Proud Canadian | IB Student | Journalist | Environmentalist | Musician♬ | Blogger | Foodie | Karateka | Co-founder @SpeakNowTV.. Fancy! Tweet me. ☺
0415ADA,Vancouver; BC,Mon Feb 09 12:59:16 +0000 2009,Not gonna lie; this is all about me. Plus maybe retweets about sustainability; food security; cities; 604 events; film. Follow at your own risk.
mdobrinskaya,Vancouver; BC,Thu Jun 09 22:29:30 +0000 2011,Politics. Food. Vancouver. Baby.
cvmevents,Vancouver,Mon Feb 23 18:19:16 +0000 2009,Home of CAN DO! Marketing & Special Event Project Mngmt.Co. Difficult is easy; impossible just takes a bit longer. Cheers; Ingrid
PairBistro,Vancouver,Wed Mar 10 09:57:21 +0000 2010,Serving the best BC local ingredients and wine since 2004
MyLoverArlo,Vancouver; BC,Sat Apr 11 23:11:59 +0000 2009,life liver. people connector. story teller. city explorer. social meteor. 
DragonTruck,Vancouver BC,Wed May 19 18:36:05 +0000 2010,Vancouver's Award Winning Pan-Asian Mobile Restaurant & Caterer. As seen on the Food Network; NY Times; Macleans... Check us out on BURRARD & ROBSON!
stephanie_ip,Vancouver; B.C.,Tue Feb 01 03:41:33 +0000 2011,I'm a reporter with 24 hours in Vancouver; B.C. Read more over at @24hoursvan or email me at stephanie.ip(at)sunmedia.ca. Views are my own.
josiepadro,Vancouver; BC,Thu Apr 14 16:01:45 +0000 2011, - health and lifestyles writer for print and the web
reidjamieson,Vancouver BC,Sun Apr 05 20:22:12 +0000 2009,'Gorgeous; sun-struck acoustic soul'- Globe&Mail. CBC Vinyl Cafe regular; Presley Sessions creator. 4 fans of Neil Finn; Jeff Buckley; Roy Orbison. Vancouver BC
bardabus,Vancouver,Thu Mar 17 19:52:45 +0000 2011,Food studies enthusiast and aspiring change-maker. Working at @RangiChangi; @ubcacco and @ubc_arts!
ElementsSociety,,Sat Mar 12 18:47:07 +0000 2011,The non-profit with the big impact - bringing environmental education; training and program support to School Districts; governments & others across Canada.
kristijanelle,Vancouver,Fri Feb 11 17:44:49 +0000 2011,One day I will live in Iceland; it will be amazing and I will hang with huldufólk all the time!
rangichangi,Vancouver; British Columbia,Sat May 01 10:34:56 +0000 2010,A grassroots non-profit working with diverse communities for a fair and healthy planet. Tweets by @masalapuri @amyculture @jessvancity
JordanTSimmons,Victoria; BC,Tue Jan 04 18:10:59 +0000 2011,Politics; mainly. Opinions are my own.
amyculture,Vancouver; BC,Tue Jan 04 22:43:46 +0000 2011,Social change enthusiast in love with sustainability; social media; and photography. Let's connect → @rangichangi @ayoudo http://bushelandpeck.org
ThomasFMoore,ÜT: 35.914178;-79.038017,Fri Apr 10 14:11:48 +0000 2009,
PowerPlantVan,Vancouver; BC,Wed Jul 08 02:17:46 +0000 2009,Green gathering for sustainability leaders; eco-adventurers + media activists. Rub shoulders; Share + Learn; Celebrate. Tweets by #PPVan founder @LorienHenson
vancouverkelvin,Vancouver,Thu Mar 12 09:48:36 +0000 2009,urban & community planning policy engagement development design architecture ambience technology sustainability conservation heritage culture mental-health food
Museumofvan,Vancouver,Wed May 27 17:56:35 +0000 2009,The latest exhibitions; happenings; local thinking at MOV. Tweets from Hanna in the audience engagement office & Amanda in communications.
brcevents,Vancouver; B.C.,Tue Oct 26 21:07:17 +0000 2010,Big Red Chair Events offers a full line of bright; bold linens; tables; chairs and just about anything you can imagine to make your event a successful event.  
thiscitylifeyvr,Vancouver; BC,Fri Oct 22 18:35:55 +0000 2010,Gov't PR/media advisor w/Masters in Urban Studies (tweets my own). Vancouver native. I love to play guitar & blog about cities: http://thiscitylife.tumblr.com 
sefalsecreek,False Creek; Vancouver; BC,Mon Jan 11 20:53:40 +0000 2010,Events + News in Southeast False Creek (including the Olympic Village) from @604homesguy (Royal LePage Westside). Also on Facebook http://fb.com/sefalsecreek.
BeeVancity,Vancouver,Sat Nov 13 04:42:38 +0000 2010,Building; Engaging; & Empowering #Vancouver thru Honey Sweet #Events. Focus on #local #eco #justice. Tweets by @masalapuri @kimieong @steph_chua @asterix
bifnaked,Vancouver,Wed Oct 08 03:20:53 +0000 2008,International Recording Artist; Speaker; Lecturer; Advocate; Activist; Straight-Edger; Vegan; and TroubleMaker. 
randomcouture,Vancouver; BC Canada,Sat Apr 24 20:42:41 +0000 2010,A young Liv Tyler raised by Tim Burton.
dogwoodbc,48.464363;-123.29999,Tue May 26 23:29:06 +0000 2009,The Dogwood Initiative helps British Columbians exercise local control to create healthy and prosperous communities.
Dave_Eby,Vancouver; Canada,Mon Sep 15 21:51:33 +0000 2008,Executive Director B.C. Civil Liberties Association; lawyer; adjunct law prof at UBC. How law pushes people to the margins; and keeps them there.
SUCCESSCanada,Vancouver; BC; CANADA,Thu Jan 28 00:53:22 +0000 2010,S.U.C.C.E.S.S. is a multi-service agency in British Columbia. 
alwaysRL,vancouver,Sun Mar 22 09:50:59 +0000 2009,I tweet about Vancouver; free stuff/deals; fashion; random rants; dogs; and medical terminology.  Medical transcriptionist student with typing speed 80 wpm.
alyssa_jayne,UBC,Tue May 19 19:05:10 +0000 2009,Overattemptingtoachieve and ignoring all negative media about John Mayer since 2006. Future Urban design student and @ubcslc 2012 co-chair.
onewetfoot,Vancouver; British Columbia,Sat May 16 15:38:05 +0000 2009,Vancouverite obsessed with community; social justice; good food; knitting (and crochet) and dogs. 
Shlizzie,Vancouver,Mon Aug 02 03:26:50 +0000 2010,Business student; music enthusiast/snob; freelance makeup artist; and smart arse all rolled up into one fabulous little package.
asgibbs,,Mon Apr 06 04:42:56 +0000 2009,Amanda Gibbs is a facilitator & civic/ public engagement specialist living and working in Vancouver; BC. 
greenestcity,Vancouver,Wed Feb 25 22:39:40 +0000 2009,Stay tuned as the City of Vancouver works out how to become the greenest city in the world by 2020.  Let us know your thoughts!
UrbanDryad,Vancouver; Canada,Thu Mar 25 14:25:41 +0000 2010,Ecology-minded mischievious chaotic huggable silly sociable curious cynical enthusiastic spammy geek permaculturalist urban landscaper of no fixed topic
carlashore,Vancouver; Canada,Fri Dec 19 05:20:35 +0000 2008,Writer; PR strategist; food policy-ist; sometimes commuter cyclist.
brentgranby,Vancouver,Mon Sep 08 04:58:16 +0000 2008,husband; father; citizen; community organizer; artist and always re-defining myself     
emital,,Sun Dec 28 18:38:45 +0000 2008,
MikeSoron,Vancouver; BC,Mon Apr 16 03:28:50 +0000 2007,the planet; social justice; & the city.
LndaD,,Thu Oct 01 23:17:00 +0000 2009,
victorngo,Vancouver; Canada,Fri Dec 12 09:06:38 +0000 2008,Geography & Urban Studies student at UBC. Passionate about cities; community development and urban sustainability.
enniscath,Vancouver,Fri Mar 27 17:05:45 +0000 2009,Expat Brit; now Canadian; scientist / writer / editor / grant wrangler / project manager; beer snob; geek.     Politics! Sport! Music! Skiing! Kayaking! TEA!
VanEconomic,Vancouver BC Canada,Fri Oct 23 15:24:23 +0000 2009,Promoting economic development for the City of Vancouver; B.C.; Canada.
jritch,Vancouver; BC,Mon Apr 23 01:24:34 +0000 2007,podcaster/radio @xenvironmental / 101.9 FM CiTR; UBC AMS sustainability coordinator; PV researcher; journalist of reorganization; collapse; energy + society
whyvonne,Vancouver; Bc,Tue Mar 20 21:23:16 +0000 2007,Community planner; design enthusiast; child care advocate.  Interested in social justice; public spaces; art + design; infographics; maps; bikes.      
lindes66,West Coast/Côte ouest; Canada,Tue Apr 12 19:56:22 +0000 2011,Documentary filmmaker -- passion for environmental; social and political issues
BrentToderian,Vancouver; BC; Canada,Wed Feb 01 06:57:12 +0000 2012,City planner + urbanist with TODERIAN UrbanWORKS; former Chief Planner for Vancouver Canada; Founding President of the Council for Canadian Urbanism
trishkellyc,Vancouver,Wed Dec 07 19:47:38 +0000 2011,an active citizen; a community builder; a good neighbour.  Expert level nerdery in  subjects food; words and hugging it out.
fredhoogstad,Vancouver; Canada,Fri Jan 16 04:02:23 +0000 2009,Web and database designer/programmer; story-teller and picture-taker. I buy and refurbish laptops. Sometimes I listen to street people and tell their stories.
AndieLemon,,Wed Oct 05 01:30:53 +0000 2011,
scott_bern,Vancouver; BC,Thu Mar 01 20:33:52 +0000 2012,Social justice lawyer with Pivot Legal Society.  Working on drug policy and housing issues.  Environmental lawyer; photographer;  cook.
AT_CostaRica,Costa Ballena ,Mon Sep 26 01:10:19 +0000 2011,Welcome!  Our mission is to show you the Lifestyle; Real-Estate & Beauty on the Costa Ballena in Costa Rica. Don't just Dream it ; Live it!  Pura Vida!  
GOURMETrepublik,Maple Ridge; BC,Mon May 30 18:38:34 +0000 2011,We are gourmet food manufacturers; home of the famous BBQ Balsamic Soy Ribs!
adilucca,Vancouver; BC,Thu Jan 07 07:10:08 +0000 2010,Community builder; world explorer & arts enthusiast. Proud to work for a financial co-op @vancitycommfdn @vancity - it's all about vibrant & just communities!
NSGP2012,Vancouver; BC,Fri Feb 11 22:45:22 +0000 2011,This project offers $50 to $500 to neighbours who want to work together on a small event; program or project that enhances their community!  
la_cornish,Vancouver,Sat Jul 02 02:21:51 +0000 2011,Climate policy geek and social change agent; music lover; wilderness canoe tripper; learning to cook with whole foods.
hydrobiking,False Creek ; Vancouver,Thu Apr 21 18:49:41 +0000 2011,New business coming soon to False Creek in the City of Vancouver.  Vancouver Hydrobikes and Pedal Boat Rentals.  Why bike when you can Hydrobike.  
LittleBeanFarms,Vancouver; BC,Tue Feb 14 18:11:18 +0000 2012,Playing in the dirt; watching seeds grow into plants and fresh picked food are just too good not to share with the little ones in our lives. 
annajwhelan,,Wed Feb 15 06:06:16 +0000 2012,
Copley_Orchard,Vancouver,Sun Feb 12 08:24:21 +0000 2012,Come join us at our community orchard between Copley; Walker and Vanness Street in Vancouver. Tweets by @darkbluewaters
ubclfsus,Vancouver; Canada,Sun Nov 20 23:42:25 +0000 2011,The undergraduate student body of @ubcLFS; the Faculty of Land and Food Systems at UBC. Official tweets from the LFSUS by @kcskou. Find LFSUS on Facebook!
VVictoryGardens,Vancouver BC,Wed Feb 01 00:59:11 +0000 2012,Victory Gardens is an urban farming project in Vancouver; BC; which offers the infrastructure; planning and education needed to grow what you eat! 
foodtype,Vancouver,Wed Mar 25 21:02:03 +0000 2009,book nerd; design student; food geek. 
stephaniemarley,Vancouver; BC,Thu Jul 16 14:48:29 +0000 2009,Registered Holistic Nutritionist
kayboom,Metro Vancouver,Fri Feb 04 07:17:54 +0000 2011,Life is like a box of chocolates. I like chocolate.
TreeCanada,Canada ,Mon Jan 31 16:52:35 +0000 2011,Tree Canada is a not-for-profit charitable organization established to encourage Canadians to plant and care for trees in urban and rural environments. 
LizBlakeway,,Fri Jan 20 05:48:51 +0000 2012,Urban student. Compost enthusiast. Over-thinker. Newbie.
PSWM_UVic,Victoria; BC,Fri Sep 16 16:30:44 +0000 2011,By working with informal recycling co-operatives in Brazil and Canada; we look at ways waste can be used as a resource and provide a livelihood.
restaurant62,Abbotsford; B.C,Thu Apr 30 20:07:08 +0000 2009,Fraser Valley's top restaurant for elegant urban dining & contemporary regional cuisine showcasing the freshest local ingredients. 
kennedy_joe,,Wed Jul 22 21:19:27 +0000 2009,
agorabora,Vancouver; BC,Wed Jan 25 20:13:02 +0000 2012,Empowering people to break down the barriers between making a living and living in community.
likokaki,Vancouver,Fri May 27 03:32:43 +0000 2011,urban planning; sustainability; design and food enthusiast
UnitarianUCV,49th & Oak St; Vancouver; BC,Sat Feb 12 05:11:33 +0000 2011,A community of diverse beliefs and shared values: spiritual growth; social justice; environmental sustainability; artistic expression; compassion. Join us! 
MLArchitecture,Vancouver,Tue Jan 19 23:48:33 +0000 2010,MLA is a full service architectural firm focused on sustainable design.
thaiaway,Vancouver; BC,Wed May 26 21:27:41 +0000 2010,Vancouver's favourite Thai eatery; and proud manufacturer of delicious; all-natural Thai Away Meals-in-Minutes.  
SFULocalFood,Simon Fraser University,Tue Mar 29 01:32:24 +0000 2011,Project of @SustainableSFU. Students for a healthy and sustainable food system on campus and beyond! Check out  http://sfulocalfood.ca/ 
SylvainMartel2,Vancouver; British Columbia,Sun Jan 15 17:18:03 +0000 2012,Aspiring Environmental Technologist minded to grow trees; shrubs and food in the cities; protect aquatic ecosystems from stormwater and improve the air quality
UrbanDigsFarm,Vancouver; British Columbia,Tue Dec 06 18:52:30 +0000 2011,Urban Digs is a neighbourhood farm growing organically in and around Vancouver. Farm fresh eggs; produce & preserves available daily! 
SCCBackpackprgm,vancouver ,Thu Jan 19 02:18:07 +0000 2012,The primary objective of the Strathcona Community Center Backpack Food Program is to bridge the weekend gaps when school food programs are not running. 
tormojet,,Thu May 12 04:38:07 +0000 2011,
odkerrie,,Wed Jan 04 00:22:06 +0000 2012,
cmthoreau,Vancouver,Sun Feb 20 04:11:30 +0000 2011,Urban Farmer. Sunflower Greens. Pea Shoots. Buckwheat Lettuce. Cut and pedaled to you within hours of harvest.  Plus: bike-powered CSA: www.foodpedalers.ca
TWiSTEDOUTREACH,Vancouver; BC,Sun Dec 11 01:17:22 +0000 2011,The TWiSTED OUTREACH PROJECT for BACKCARE and SCOLIOSIS is a studio and resource centre for anyone interested in learning about backcare and scoliosis!
mccrearycentre,Vancouver; British Columbia,Wed Jul 14 19:16:32 +0000 2010,Youth health • Youth research • Youth engagement
kevanmatheson,Victoria,Mon Sep 19 03:16:31 +0000 2011,Half man half tree; I tweet about everything green. I talk about green buildings; agriculture; business etc..all certified organic.
tylerjalgeo,,Sat Mar 19 20:09:29 +0000 2011,
notwithoutit,Canada!,Fri Mar 13 20:21:53 +0000 2009, Ed student. 
MmeLionHead,,Fri Dec 09 22:55:36 +0000 2011,Simplicity. Creativity. Sustainability. Education. Food.  
scoutmagazine,Vancouver; British Columbia,Fri Oct 10 16:10:46 +0000 2008,Vancouver's leading local magazine on independent food and culture. Tweets by: Andrew Morrison (AM); Michelle Sproule (MS); and Kimberley Ong (KO) 
CharleneMeliss,,Fri Dec 02 20:18:23 +0000 2011,Passionate about social and environmental justice; sustainable community development; art; social change; and inspiring alternative visions for the future.
Lessthan10vanco,Vancouver,Mon Sep 19 05:45:08 +0000 2011,We are just a couple of poor assed islanders.  
CoVYouth,Vancouver; Canada,Wed Aug 25 18:55:52 +0000 2010,This is the page for www.vancouveryouth.ca; the City of Vancouver's website for young people: events; programs; services; volunteer opportunities; and more! 
VancouverRHN,Vancouver; BC,Sun Oct 23 06:05:08 +0000 2011,I am a Registered Holistic Nutritionist living and practicing in beautiful Vancouver BC. 
VancouverCoops,Vancouver; BC,Tue Oct 05 23:37:51 +0000 2010,The Vancooper: bylaw-compliant;pest defiant; not-too-giant coop for the self-reliant and epicurious client. dailyeggs.com
VancouverMommie,vancouver bc,Mon Mar 30 22:39:36 +0000 2009,City-dwelling mom of one; partner; friend; social media geek; investigator at heart; blogger; promoter! 
VillageCleaners,Vancouver; BC; Canada,Sun May 15 17:53:07 +0000 2011,High-end environmental garment cleaning; tailoring; shoe repair; key cutting; and sanitizing with a plethora of additional value-added options.
PtboCommGardens,,Wed Feb 17 15:08:43 +0000 2010,Cultivating Communities; One Garden at a Time
VancouverNCM,vancouver; bc,Tue Nov 08 15:35:08 +0000 2011,Vancouver's food hub concept. Tweets by Darren Stott; Business Plan Lead.
LovingHut_Vanc,Vancouver; BC; Canada,Thu Jun 16 09:04:34 +0000 2011,Loving Hut Express Food Cart; in Yaletown; Downtown Vancouver. Serving Delicious Burgers; Gourmet Sandwiches; Yummy Sides; Sweets; Seasonal Items & More!
evergreenBC,Vancouver; BC,Thu Oct 20 21:15:45 +0000 2011,Evergreen is a national non-profit that makes cities more livable by connecting people with nature.
EcoChristie,Vancouver,Sun Oct 09 19:19:16 +0000 2011,Follow my journey towards sustainability through thrifty non-intimidating baby steps in my Blog Ecofriendly Evolution. Follow the link from my website!
This__Space,Vancouver; BC,Fri Jul 08 17:08:28 +0000 2011,“We’re calling on Strathcona & Chinatown to build a sustainable business they can call their own...”
