farmersdotter2,☯ Cawston; BC ,Sun Dec 19 08:31:40 +0000 2010, Grower/Supplier @farmersdotter Certified Organic Garlic & all things good for the palate and plate. Just don't ask to borrow any equipment. Ever. Cheers!
EsperGarMar,,Sat Nov 12 19:34:10 +0000 2011,
liblearning,British Columbia,Fri Jan 08 14:51:37 +0000 2010,Working Together to Transform Child Care in British Columbia. Tweets are by @tomkertes.
sondibruner,Vancouver,Mon May 18 02:41:32 +0000 2009,Freelance journalist; holistic nutritionist and gluten-free/dairy-free food blogger. 
meg_mittelstedt,Vancouver; BC,Thu Sep 29 19:46:23 +0000 2011,Writer and student in the UBC Masters of Journalism program; working in the Mount Pleasant neighbourhood.
VCHhealthcare,Vancouver; BC,Tue Jun 14 17:24:20 +0000 2011,Vancouver Coastal Health delivers healthcare services to British Columbians in the Lower Mainland; Sunshine Coast; Sea to Sky and Bella Bella; Bella Coola. 
contessak,Vancouver; BC; Canada,Fri Aug 15 07:19:18 +0000 2008,Urban planner; social media geek and undercover folk musician in Vancouver; Canada. I blog at www.planningpool.com
SouthSurreyBuzz,South Surrey; BC,Tue Dec 13 22:43:31 +0000 2011,Contact me if you'd like your event or business promoted for free! email southsurreybuzz@gmail.com  Tweets by Sabinah!
meghancooke,Vancouver,Fri May 08 04:27:40 +0000 2009,I am a personal trainer and nutrition coach who sometimes plays at being a fitness competitor; stuntwoman; actor and stage combat coach.
sdiguistini,Royston; BC,Thu Feb 24 17:07:59 +0000 2011,Entrepreneur and yogurt enthusiast
jillbarber,Vancouver; BC,Wed Apr 15 04:33:27 +0000 2009,Songwriter; torch singer; hopeful romantic; vinyl lover; hat revivalist; foodie; cbc devotee; aspiring french-speaker; maker of records; excellent wine-pourer.
tomkertes,Vancouver; B.C.,Mon Apr 13 15:00:35 +0000 2009,Building bridges and removing barriers to help ensure that everyone's included in stronger communities.
FFCF,Vancouver; BC,Tue Nov 25 04:33:12 +0000 2008,Farm and City working together to cultivate a local; sustainable food system in British Columbia. Also on Facebook @http://www.facebook.com/FarmFolkCityFolk
cambiegirl,Vancouver; BC,Thu Jan 29 05:40:14 +0000 2009,Wholesale Sales for JJ Bean Coffee Roasters. Aspiring Champion of Social Change. Occasional Neurotic.
thelizzypearl,Vancouver ,Sat Nov 28 19:09:02 +0000 2009,words. tasty things. good songs. long runs. dirty jokes. open bottles of wine. jelly beans. stories at @raincityvan. managing accounts @villageandco.
bcooksd42,Pitt Meadows; BC,Tue Mar 01 23:49:52 +0000 2011,Foods 8-12 teacher; striving for meaningful learning & assessment. I'm crazy about growing & making real food; and building a positive classroom community.
pladner,Vancouver,Thu Jan 15 19:59:00 +0000 2009,Author; The Urban Food Revolution: Changing the Way We Feed Cities; recovered politician; columnist and co-founder at Business in Vancouver @bizinvancouver
matlyle,,Wed Jan 27 23:41:54 +0000 2010,
YoMountPleasant,Mount Pleasant; BC,Fri Sep 23 03:33:43 +0000 2011,I'm a new resident of Mount Pleasant; covering the neighbourhood as a student journalist with UBC's Graduate School of Journalism. Please introduce yourself!
JoinaCoopDay,,Sat Nov 05 21:34:00 +0000 2011,Let's put our money where our mouths are: let's put Wall Street; the banks and corporations on notice by joining in the co-operative movement.
VIPIRG,Victoria; BC,Wed Nov 02 20:30:18 +0000 2011,VIPIRG is a non-profit dedicated to #research; #education; #advocacy; & other action in the public interest connected to social justice & environmental issues. 
Hatshepsut_2,Canada,Thu Mar 31 18:22:53 +0000 2011,Love to travel around the World with a good pair of shoes
SlowFoodVan,Vancouver; BC,Fri Jun 05 00:04:14 +0000 2009,Supporting good; clean and fair food. Tweets about events; issues and what's happening in the food world.
WorkSmartKits,U.S.,Tue Aug 10 18:45:01 +0000 2010,All-in-one ergonomic wellness kits designed for desktop and laptop workstations with input from ergonomics professionals and chiropractors. 
foodandtell,Vancouver; BC,Sat Oct 24 01:14:04 +0000 2009,Food and Tell is a collaborative food blog; focusing on eating and cooking in Vancouver and further afield.
EatStTweet,,Sat Feb 19 00:28:23 +0000 2011,We're here to help you find the best street food across North America on TV; the web and on your iPhone!
TTS_Pathways,390 Main Street; Vancouver; BC,Mon Oct 03 08:35:30 +0000 2011,Not your typical employment centre; Pathways employs a holistic approach to serve DTES residents who face many challenges and are often chronically unemployed
StreetFoodApp,Vancouver; BC,Sun Jan 09 17:23:49 +0000 2011,The best way to find food trucks in Boston; Calgary and Vancouver. For iPhone & iPad. On Android? Go to http://streetfoodapp.com
gvof,Abbotsford; BC Canada,Tue Feb 16 17:50:42 +0000 2010,News and musings from Glen Valley Organic Farm's Chris Bodnar in Abbotsford; BC. A 50 acre; co-operative; organic farm.
naturopathicdrs,Toronto (head office),Sun Dec 26 17:08:10 +0000 2010,National NFP voice of the Canadian naturopathic medical profession. For a referral to a qualified naturopathic doctor in your area visit our website.
fazetasn,,Mon Oct 24 03:33:42 +0000 2011,Change Agent in training
LiveLaughLuvEat,Vancouver; BC,Mon Oct 17 18:57:13 +0000 2011,
sincerelyross,ÜT: 49.278892;-123.124872,Tue Jun 16 04:52:53 +0000 2009,Graphic & Type Designer living in Vancouver; Canada. Partner with @workingformat
GardeningTLL,,Thu Oct 27 00:11:02 +0000 2011,The gardening news; reviews and discounts feed. We share insights; reviews; popular product links; daily discounts and news.
leungmi,Vancouver,Tue Dec 09 09:47:52 +0000 2008,
EyadNateel,Gaza,Sat Aug 27 02:19:59 +0000 2011,
eatwithjenny,Vancouver; Canada,Thu Oct 27 21:40:30 +0000 2011,@_JennyShen's gluttonous tweets | Love sweets & budget eats | Subscribe to food freebies; deals and events at http://on.fb.me/eatwithjenny
thisgirlsfood,Vancouver; BC,Sun Jul 12 16:40:56 +0000 2009,I write; I eat; I garden. I can make a kick-ass latte while discussing the merits of a localized and biodynamic food system.
juliaspitale,Vancouver,Tue May 12 17:49:16 +0000 2009,lover of life; communication professional; singer/songwriter; community coordinator; traveler; personal cook. http://www.wheelyslowcookingtour.com  
davidtracey,Vancouver.,Sun Dec 14 16:10:13 +0000 2008,Writer/designer/community ecologist. Author of Urban Agriculture: Ideas and Designs for the New Food Revolution and Guerrilla Gardening: A Manualfesto.
LindsayGlauser,Vancouver BC,Mon Mar 02 22:15:34 +0000 2009,WRITER and LOVER of ALL THINGS BOOKS; FASHION; ART; LIFESTYLE and CULTURE 
darntasty,Agassiz; BC,Fri Jul 15 00:26:11 +0000 2011,no additives. non-medicated. organic fed. open fields. fresh water. Halal certified. and darn tasty!  www.tastychicken.ca
HealthiestComm,Cheshire County; NH,Thu Jan 13 20:15:10 +0000 2011,Vision 2020 is a healthy community initiative to make all of Cheshire County the healthiest county in the nation by 2020! 
farm_love,Vancouver; B.C.,Tue Dec 07 18:45:03 +0000 2010,Farm Love is a photo blog dedicated to growing the food movement locally and internationally.  Tweets by: saradent.ca
valinecrist,,Thu Feb 11 19:09:44 +0000 2010,haida | indigenous | student | researcher | writer | eco-warrior | tweeter | aunty
CinciCsere,Vancouver; BC,Fri Aug 08 23:54:50 +0000 2008,a creative problem solver & dreamer inspired by design; film; music; food; travel; culture; farms; animals; my Canon 7D & my dogs.
LannaThaiVan,West End Vancouver,Sat Oct 08 17:57:57 +0000 2011,Authentic Thai cuisine featuring the dishes of the North. Come find us on Denman and Robson. Tweets by the niece. ^^
raincityvan,Vancouver; BC,Sun Oct 25 17:05:13 +0000 2009,We are a series of storytelling nights featuring a diverse roster of Vancouverites. We'd like to be your friend.
LimeMarie,Vancouver,Thu Mar 18 23:21:08 +0000 2010,Grad student researching how to improve coordination of First Nations health care. Opinions are mine alone. 
vini_v_,Hamilton; ON,Thu Nov 05 22:10:14 +0000 2009,mcmaster biopharm student | indie music fan | social entrepreneur | interest in healthcare & policy | seeking to be connected and make connections @palimsessed
yogaandmassage,BC,Mon Jul 04 06:37:29 +0000 2011,The Vancouver School of Bodywork & Massage is a boutique institution offering an unparalleled educational experience. Reach Us At: (604) 757-1082
Elle_Ann,,Fri Feb 01 20:48:34 +0000 2008,One cannot think well; love well; sleep well; if one has not dined well. ~ Virginia Woolf   
MegaphoneMag,Vancouver,Thu Dec 18 23:47:58 +0000 2008,Megaphone is a magazine sold on the streets of Vancouver by homeless and low-income vendors.
karenesterly,Vancouver; BC,Tue Dec 02 22:45:37 +0000 2008,
limkrisha,,Sat Apr 09 21:37:52 +0000 2011,UBC Women's Rowing team coxswain; third year UBC Economics and International Relations student
foodhappy,Burnaby; BC,Fri Feb 27 19:16:28 +0000 2009,
toriyakiinvan,Vancouver; Canada,Sun Dec 12 07:18:08 +0000 2010,Japanese stay-at-home-mom living in Vancouver...a bit geeky about food; movies and manga!  食べ物、映画、濃い漫画が好きな; バンクーバー在住の主婦であります。
youngagrarians,Canada,Thu Oct 21 21:42:41 +0000 2010,Growing the next generations of farmers in Canada!  Young Agrarians is a partnership with FarmFolk CityFolk.  Tweets by: saradent.ca
foodee,Vancouver; BC,Fri Jan 28 23:07:23 +0000 2011,Food.ee is the easiest way to order take out & delivery online. We tweet about all things related to food. Join the conversation on Facebook. http://ow.ly/7ij8d
DASH_NY,New York State,Wed Jun 23 20:30:56 +0000 2010,New York State's Obesity Prevention Policy Center and Coalition  Designing a Strong and Healthy New York
zedfo,Vancouver; Canada,Thu Mar 31 07:15:44 +0000 2011,Food systems thinker/doer; lover of Canadian music; maker of lists; urban wanderer; bike rider; friend of inspired people; frequenter of public libraries. 
mhodder12,Lake Country B.C.,Fri Dec 10 18:26:50 +0000 2010,Food and wine lover! Vancouver Canuck Hockey Fan! Local food! Steveston! Golf!! Okanagan Center!! Edible Canada at the Market
inhousefestival,Homes in Vancouver,Mon Oct 19 23:30:59 +0000 2009,Live multicultural; multidisciplinary shows in people's living rooms and backyards. Music; dance; cabaret; circus; theatre; spoken word and more.
beetrootsgross,Vancouver BC,Tue Mar 23 03:40:02 +0000 2010,
silver_charm,,Wed Apr 08 11:33:23 +0000 2009,Love writing food horse racing.  Transformations continue to abound which is great news 4 telling my stories. Have a super; sunshiney kind of a day!
EcoFarmDay,Eastern Ontario; Canada,Wed Jan 05 19:11:56 +0000 2011,Eastern Ontario's premier farm conference. Farmers rely on Eco Farm Day for the best training; information; and commerce opportunities.
NicliPizzeria,Vancouver,Tue Apr 13 16:05:54 +0000 2010,Vancouver's first Vera Pizza Napoletana restaurant on the edge of Gastown.
askcooq,Vancouver;BC,Fri Apr 22 00:39:48 +0000 2011,Check us out here....http://cooq.com  App coming soon; Tweet us your food questions;  and will tweet you back an answer!
AL720,,Tue Nov 16 03:07:36 +0000 2010,
diversityjobs,,Thu Jun 26 16:36:25 +0000 2008,Breaking news in Diversity
feastoffieldsO,Ottawa ON,Fri Jul 10 16:30:07 +0000 2009,Feast of Fields is an annual event where local farmers and chefs from the  Ottawa region team up to create an organic feast for the public.
alison_henning,Vancouver,Tue Jun 02 15:23:17 +0000 2009,Communications/Marketing Manager at Tides Canada  *personal account* | Cyclist | Nice To Tweet You
TerraKaethler,,Tue Oct 18 21:22:24 +0000 2011,
CornelieusMtbL,Vancouver,Wed Mar 30 21:07:00 +0000 2011,
EricaMattson,Vancouver; BC,Fri Mar 27 16:25:14 +0000 2009,Arts; culture; communications and other musings. Also at @nestandsparkle; @VIA_Reads contributor and member of The Writer's Studio at SFU.
BuildLeadChange,Vancouver BC,Mon Nov 15 23:01:59 +0000 2010,Lover of all things community
Nu_Nature,,Wed Jan 04 22:27:17 +0000 2012,
ApolloCarts,Vancouver Canada,Tue Oct 26 11:32:10 +0000 2010,We build the Concession Trailers & Food Trucks that sell the great food. Gourmet Street Food Carts & Mobile Restaurants on Wheels. 
selinjessa,pale blue dot,Sun Feb 07 20:54:14 +0000 2010,Insatiably curious hs student + passionate about the intersection of science; art and technology for social change. selinjessa at gmail dot com.
