QueenoftheParks,Canada,Tue Mar 10 20:37:52 +0000 2009,Sex work advocate politician who enjoys life. Running for Vancouver Park Commisioner. Vote November 19 to Keep Our Parks Public.
KarmaDLee,,Sat Apr 03 06:07:27 +0000 2010,
GECCoop,Maple Ridge/Pitt Meadows,Fri Mar 11 06:27:06 +0000 2011,Vision: to open a storefront Co-op for #mapleridge & #pittmeadows offering local products; helping to strengthen community and re-localize our economy. #GECCoop
De4Council,Richmond; BC,Thu Apr 14 06:27:02 +0000 2011,I stand up for farmland preservation; social justice; affordable housing; food security & belongingness. Election Nov 19!!
DavidValente,Vancouver; BC; Canada,Wed Feb 25 07:19:24 +0000 2009,Your Vancouver Real Estate Specialist. Prudential Sussex Realty; North Vancouver; West Vancouver; Downtown Vancouver; Luxury Fine Homes; Award Winning Realtor
Cinecraig,Vancouver,Tue Dec 29 00:34:38 +0000 2009,Staff writer for the Georgia Straight; Vancouverite; and more.   If you're hoping to send information; please send emails to contact@straight.com. 
MMEventsInc,Vancouver B.C.,Sat Aug 07 09:10:01 +0000 2010,At Modern Mint Event Coordinators Inc.; We organize social gatherings; weddings; fundraisers; charities; as well as corporate events.
IEC_BC,Vancouver; BC,Wed Sep 28 17:54:54 +0000 2011,The Immigrant Employment Council of BC helps employers gain a competitive advantage by connecting them with immigrant talent. Tweets by @roleychiu
odinperez,,Tue Jul 07 15:05:58 +0000 2009,
sendabottle,Vancouver,Wed Sep 07 04:33:49 +0000 2011,We are the easiest way to say Thank You in wine. No longer do you need a PHD to send a bottle of wine quickly; affordably and with ease. Coming Soon!
ParharD,Vancouver; British Columbia,Thu Oct 06 00:37:55 +0000 2011,Citizen Services Professional for City of Vancouver. Notoriously friendly; engaging & genuinely interested in getting to know you! And the YOU is everyone.
VanSocialPolicy,Vancouver; BC,Tue Aug 23 20:47:41 +0000 2011,CoV Social Policy works to address critical social issues facing Vancouver: food security; immigration; child/youth/senior/family policy; urban health. 
FortisBC,British Columbia,Mon Jan 26 23:18:03 +0000 2009,A leading BC energy provider. Tweets brought to you by FortisBC Communications. We're here Mon-Fri; 9-5; unless otherwise noted with important information.
votebettervsb,Vancouver BC,Thu Oct 20 17:53:04 +0000 2011,Louise is running for School Trustee. Louise’s work has involves advocating for quality; affordable care and early learning for Vancouver children. 
TantraMassageBC,Vancouver; BC | Singapore,Fri Sep 23 08:44:02 +0000 2011,Tantra Masseur & Masseuse Couple for Women; Men & Couples.  Locations: Vancouver; BC & Singapore | Available: 24/7.  Email: viptantramassage@gmail.com  
goolsofjewels,Vancouver,Sat Jul 18 02:56:43 +0000 2009,Canadian; Traveler; Writer; Communications Coordinator and student of web design in Vancouver
GillsterMEDIA,Surrey; BC,Fri Jul 15 01:40:51 +0000 2011,It's all about the network - You are defined by your network. We develop result producing interactive websites.
CanAmSecurity,Vancouver BC,Tue Oct 18 19:46:23 +0000 2011,CanAm is an industry leader in providing contract security; consulting; investigation; K9 detection & patrol;  risk management in Vancouver BC & Abroad.
teerance,Vancouver,Sat Jun 20 09:40:41 +0000 2009,Simple Guy/Entrepreneur/Blogger. In2 Fitness/Health; Travel/Adventures; Cars; Music and Fashion. I am here to Love; Learn; Grow and Live the Dream.
marco_aquila,British Columbia; Canada,Mon Dec 14 20:29:57 +0000 2009,
NSPartyBags,Vancouver; BC,Mon Apr 11 01:05:07 +0000 2011,We have started an online Pre-filled party bag service. At the moment we have 11 different kids themed bags with several additions. Check it out! 
mktgmentress,Vancouver Area,Thu Jun 16 20:40:13 +0000 2011,#Mentress;#marketer; #motivater; #podcaster; #coach;#speaker; #enthusiast;#consultant;
TeamPAL,British Columbia,Thu Dec 03 17:30:00 +0000 2009,The Physical Activity Line is a FREE phone line and online resource to active & healthy living. Call (1-877-725-1149) or log on now to GET MOVING!
xiyonce,vancity,Sat Oct 15 02:44:43 +0000 2011,@SFUBeedie+@SFUCMNS student || External Coordinator @sifebannerbags || forever a fanatic of hockey & @VanCanucks & naps & green or blue nail polish
Afuwa_,,Mon Oct 03 06:52:05 +0000 2011,Artist; facilitator; designer; maker.
VanLimo,vancouver,Thu Apr 22 07:30:21 +0000 2010,Limousine service at its best serving Vancouver and lower mainland.
YVRcondos,,Fri Oct 14 20:25:21 +0000 2011,
vlopeza,Vancouver; Canadá,Mon Apr 13 03:22:16 +0000 2009,
W2Radio,DTES; Vancouver,Sat Oct 15 04:46:48 +0000 2011,Broadcasting in Vancouver at 102.7FM; Mon to Fri; 6 to 8am; streams http://www.coopradio.org/content/listen Get involved! radio@creativetechnology.org
__JLee,Vancouver; BC,Mon Nov 02 04:38:07 +0000 2009,I wish I was a slave to an angel trade.
ToriesParty,Delta; BC,Fri Oct 07 17:17:17 +0000 2011,The Conservative Party of Canada | Re-elect us in the 2011 Mock General Election of Canada (Humanities 11 Project)  
VanAFL,Vancouver; BC,Mon Aug 22 20:41:05 +0000 2011,Join us for ART FOR LIFE Fine Art Auction-An Auction in 3 Acts including: Public Dreams Society;Joan-E & Bif Naked November 26- proceeds go to Friends For Life
sgulati,Vancouver; Canada,Wed Jul 25 20:26:16 +0000 2007,Environmental economist; occasional blogger; and faculty at the University of British Columbia.
GeoffN28,vancouver; bc; canada,Sat Apr 11 07:10:23 +0000 2009,i am reaching new highs with a family; higher education; and afterward a new career.
AphrodisiacShop,Vancouver; BC,Fri Oct 14 03:55:02 +0000 2011,ONLINE Store | 100% Natural Male Sex Enchanes | Herbal Sex Products | Wodibo Sex Pill | Blue Dragon Sex Capsules | Blue Dragon II Sex Medicine!
sarenatalbot,Vancouver,Thu Feb 17 22:38:01 +0000 2011,Passionate about community. Committed to social change. Certified skipper. Education Program Assistant @CoDevCanada. Candidate Liaison @COPEVancouver.
CowleyCouncil,Maple Ridge; BC,Tue Sep 27 20:17:53 +0000 2011,Biz oriented sustainability advocate seeking a liveable Maple Ridge thru sensible urban planning; farmland conservation & business revitalization. #Stopsprawl
ThinkVanCity,,Wed Oct 05 21:23:35 +0000 2011,
LindaGilmaster,,Sat Feb 26 23:38:18 +0000 2011,
penguinstorm,Out here on the raggedy edge.,Tue Apr 14 03:14:00 +0000 2009,Picture taker. Word maker. I shoot a lot of live events; portraits; products and places. Also; apparently; a Wilco fan. http://tinyurl.com/7pubzhw  
JustinC009,Port Moody; BC; Canada,Mon Jul 20 01:13:30 +0000 2009,Sociology Undergrad @ SFU  Sustainable living winning!
PlaceSpeak,Vancouver,Sat Jan 08 01:07:43 +0000 2011,PlaceSpeak is a location-based consultation platform that connects citizens to local issues. Claim your place. Speak your mind. Most tweets from @YuriArtibise.
seramarieblaze,Vancouver BC Canada,Mon Mar 15 17:47:57 +0000 2010,
Garossino,Vancouver,Tue Aug 23 03:10:24 +0000 2011,Sandy Garossino on civic affairs. Sandy ran as an Independent candidate for Vancouver City Council in 2011.    
RawCanvas,1046 Hamilton Street,Sat Jun 13 23:15:07 +0000 2009,Do something different tonight...    EAT. DRINK. MAKE ART.    Raw Canvas will revolutionize the way you socialize.
jeanhakizimana,Vancouver,Fri May 29 14:36:07 +0000 2009,Jean is an interpreter and community organizer who brings energy; passion; and creativity to individuals and organizations to implement positive social change
LookoutSociety,Metro Vancouver,Fri Oct 07 15:06:06 +0000 2011,Lookout Emergency Aid Society is a Vancouver non-profit organization providing services and housing to men and women who are destitute and require assistance.
pizzafreshslice,Vancouver; Canada,Fri Apr 29 23:10:01 +0000 2011,Award winning multigrain and healthy low fat pizzas; create your own pizza; chicken wings; salads and drinks. Learn more about franchise opportunities
RockwellsOnline,,Mon Jun 20 04:02:27 +0000 2011,Check out our website; Facebook page or come visit any of our four locations (Mission; Creekside Village; Coquitlam or Cloverdale)
monikapearl,Vancouver,Sun Nov 01 22:48:33 +0000 2009,Your less-than-average Vancouverite: recent UBC graduate [Environmental Sciences]; fair-weather cyclist; transit enthusiast. 
UnionFoodMarket,Strathcona,Fri Apr 23 06:28:32 +0000 2010,Neighbourhood Market in Strathcona on the Adanac bike route. Traditional Portugese foods; homemade meals;fresh baked breads; sandwhiches; coffees and much more!
vanvotes,Vancouver; BC,Sat Oct 01 23:27:16 +0000 2011,A resource for info; issues + candidates from the #vanelxn. Developed & managed by the @vpsn. An info site: We are not endorsing a specific party or candidate. 
Joanne_See,Vancouver; BC,Fri May 13 21:10:11 +0000 2011,BC Public Relations Professional with aim to represent the Public Sector. Passion for health & fitness; public policy; leadership; and community engagement.
SurreyBCRealtor,Surrey BC,Sat Sep 24 05:27:47 +0000 2011,Surrey Real Estate Expert. Your Realtor of Choice for Buying or Selling a home in Surrey; White Rock; or Greater Vancouver; BC.
ROYLandscape,Burnaby; BC; Vancouver; Canada,Mon Jul 11 22:02:58 +0000 2011,Providing Landscape Services for the Vancouver; British Columbia.  
nickmjow,Vancouver,Tue Mar 29 19:25:02 +0000 2011,A grad student in public admin who loves public policy; innovation;  and health and fitness.  BA Political Science and Criminology
RichportFord,Vancouver; British Columbia,Fri Jun 10 18:29:38 +0000 2011,An honest; professional; and friendly Ford Lincoln and SVT dealership serving Vancouver; Richmond and it's surrounding areas.
604ster,Vancouver,Wed Sep 28 18:28:27 +0000 2011,604ster is an organization dedicated to providing unique; local artwork to the general public with all proceeds generated going towards registered charities. 
VancouverBeacon,British Columbia,Wed Sep 28 20:24:57 +0000 2011,Independent Online Local News – We deliver your news – local news; political commentary; columns; feature stories. Try Beacon E-Marketing
PCDentalGroup,Vancouver; BC,Mon Jul 18 23:09:41 +0000 2011,Downtown Vancouver dentist in Pacific Centre Shopping Mall; for cosmetic (veneers; Invisalign; whitening); laser dental; & restorative dental. (604) 669-1016!  
Zedamark,VANCOUVER,Thu May 28 05:33:54 +0000 2009,I've been PMSing for twenty-one years straight. 
TranBC_LMD,Lower Mainland District,Thu Sep 29 15:58:47 +0000 2011,Latest info from the Lower Mainland on what the Ministry of Transportation & Infrastructure does & why; so you arrive safely & on time. Check road info @DriveBC
KDentistry,Vancouver; BC,Wed Jul 27 18:37:34 +0000 2011,Kerrisdale Cosmetic & General Dentistry in Vancouver; BC. For mercury-free fillings; teeth whitening; smile makeovers and more. Call us today at (604) 263-7355
kcabor,Vancouver; BC Canada,Wed Sep 14 08:26:03 +0000 2011,Dreaming of #bamboobikes #kendo and #revolution through #innovation 日本語 長崎 諫早市 
LaurelGi,Vancouver; BC,Thu Jul 14 20:45:30 +0000 2011,A Environmental Studies Student with a Passion for NGOs; a Fundraiser Extraordinaire; an Avid Environmentalist & a Member of the Coolest Dodgeball Team Around.
raincityparent,Metro Vancouver; Canada,Fri Feb 04 20:03:35 +0000 2011,Resources for parents and their children. Recalls; events; recipes; reviews; links to articles & lots more!  Like us on Facebook: Raincity Parent 
123_Dentist,Vancouver; BC,Tue Jun 21 15:50:17 +0000 2011,123 Dentist Community Network helps you find a dentist in Vancouver; Burnaby; Surrey; Richmond; Maple Ridge & more. Contact us at 1-855-222-1123
PeterProHST,British Columbia,Mon Sep 12 22:19:10 +0000 2011,Resident of the most beautiful place in the world.
DrKenPhillips,Vancouver BC,Mon Sep 26 23:14:56 +0000 2011,Consumers Advocate and All Around Know-It-All (and might practice a little medicine here and there).  My good days are guitar; golf; biking and hot tubbin'!
s_martphones,Vancouver; BC,Mon Jul 04 10:11:58 +0000 2011,The Official Twitter Account for YALETOWN WIRELESS & S-MARTPHONES.COM. Yaletown Vancouver's Only Spot to Unlock; Repair; and Consign your Cell Phone!!!
SkillsChildCare,Richmond BC,Fri Sep 23 16:29:21 +0000 2011,Substitute Child Care Provider for Family Child Care; Nannies or Baby Sitters who Require Assistants Check Us Out http://www.facebook.com/SkillsforLifeChildCare
EcoHomeSpa,British Columbia,Wed Sep 28 07:07:32 +0000 2011,Organic socially conscious pampering products manufactured for you with love in Beautiful British Columbia
adixon77,,Fri Apr 01 18:19:29 +0000 2011,
LouieJacqueline,Vancouver; B.C.,Fri Jul 01 21:40:21 +0000 2011,A thinker sees his own actions as experiments and questions--as attempts to find out something. Success and failure are for him answers above all.  F. Nietzsche
aimeegrane,Vancouver; BC,Tue Jun 14 04:27:19 +0000 2011,
cliqzvancouver,,Wed Sep 28 14:33:11 +0000 2011,
DreamRental,Vancouver; BC,Mon May 11 20:25:17 +0000 2009,Dream Rentals offers a variety of luxury condos and townhomes; right in the heart of beautiful downtown Vancouver; BC.
CarlosLins_CA,Vancouver; BC,Wed Aug 03 18:25:02 +0000 2011,
acleanvancouver,Vancouver;BC,Sat Sep 10 15:23:38 +0000 2011,With over 20 years of experience in Janitorial Management Services in The Vancouver area. 604-888-1588
VancouverBCgift,Vancouver; BC,Thu May 26 00:17:13 +0000 2011,Hi :) We are SeaScape Gift Baskets of Vancouver BC;Canada. Creating gifts for special occasions and corporate clients. Let's connect! 1-866-414-4387
sarahkstoner,Vancouver; BC,Fri Mar 11 15:37:09 +0000 2011,
dena_girl,United States,Wed Mar 25 04:09:04 +0000 2009,#Write #Photo #Comm #Narrative #Lead #Research #Faith #Love #Health #Edu #Vocation #Live @TextNPixels @ZagAlumni @UW #renton_wa
PepperWireless,Vancouver; BC; Canada,Thu Sep 22 19:59:09 +0000 2011,Pepper Wireless;   your Fido's exclusive dealer in Metro Vancouver.  Follow us on Twitter or Facebook for exclusive offers and contests!  
6044424604,vancouver,Tue Sep 13 00:28:03 +0000 2011,
eliteelecbikes,Canada,Sun Jan 09 19:45:39 +0000 2011,The most powerful street-legal electric bicycles (e-bikes) on the market. Ideal for police bike squads; employer bikeshare programs; and daily commuting.
tawnya84,Vancouver; BC,Tue Aug 30 00:27:51 +0000 2011,Consumer Marketing with @myvancouver - outdoor enthusiast who can't live without great friends; family; good conversation; good food; fun & laughs.
StephBlizzack,Van City; yo!,Tue Mar 10 07:07:59 +0000 2009,Gamer; blogger; internet enthusiast; I like sunshine and relaxation; food and friends. Loving life and hoping to write about it all one day!
liquiddeli,Vancouver; BC,Wed Mar 18 00:56:23 +0000 2009,Mom.Winemaker for 22 years.Make wine; beer; vinegar; cider.Love wax paper; hate plastic.Small footprint; shop locally. This is a beautiful place let's keep it!
Jeffwonef,Surrey,Sat Oct 24 16:15:49 +0000 2009,promoter for ViSalus Sciences call me for details 778-991-0407
davesgeekyideas,Vancouver BC,Tue Feb 15 23:01:23 +0000 2011,Video Game artist who creates all kinds of geeky ideas. Sky is the limit. Check out my new site at http://davesgeekyhockey.com/
WendyLind,Vancouver; BC Canada,Wed Feb 24 22:03:02 +0000 2010,I am an Acupuncturist working just off Granville. New: Needle-less Acupuncture
Aimee_CAPS2012,Vancouver; Canada,Mon Sep 12 21:32:09 +0000 2011,CAPS-ACÉAU Conference 2012/Canadian Association of Planning Students Conference 2012/ Director of Volunteer Management/ Social Media/ Planning enthusiast/ 
StraightLGBT,Vancouver; British Columbia,Mon Aug 22 21:17:03 +0000 2011,Check out the Georgia Straight's LGBT coverage on our LGBT blog. Because the Straight is as gay as you are.  Email: lgbt@straight.com
1HateOfTheWeek,Vancouver; B.C.; Canada,Sat Sep 17 06:06:25 +0000 2011,A weekly blog about all things hate-worthy. Because even hate needs a little love. 
MYRASystems,British Columbia,Fri Jul 22 18:46:46 +0000 2011,
LangleyWellness,Walnut Grove; Langley; BC,Fri Aug 13 23:39:06 +0000 2010,Services: Chiropractic| Registered Massage Therapy| Active Release Treatment| Foot Orthotics| 601-21183 88th Ave. Langley; BC V1M 2G5| 604.882.0911 |
lifemovesca,North Vancouver; Canada,Mon May 25 20:44:35 +0000 2009,Lifemoves Health & Rehabilitation - Kinesiologists; experts in getting people with chronic illnesses; disabilities and or injuries moving for life. Alfred Ball
RotaryAwards,Delta BC Canada,Tue Aug 09 06:33:08 +0000 2011,Calling for nominations for ethical business in the Delta BC area. Deadline is September 25th 2011
melaniemcshim,Vancouver; BC,Sun Aug 08 04:59:31 +0000 2010,Interests are: Scandinavia; communications & media; world exploring; urban design; social change. Working on Surrey Memorial Hospital Redevelopment & Expansion.
lee_johnso,,Mon Sep 12 21:38:47 +0000 2011,Lee Johnson - Graduate Student at SFU/ CAPS Conference 2012 Planning Committee/ Soccer player/ island grown  
jdubcon77,Vancouver; BC,Tue Jan 13 19:26:39 +0000 2009,
CJVanc,Vancouver,Wed Sep 16 06:08:34 +0000 2009,I work at Vancity as a Marketing Specialist. I love to try new things; travel and meet interesting people.
ShawSabey,Vancouver; BC,Wed Jan 12 17:15:14 +0000 2011,You need insurance to operate; why not work with someone who understands your business? If you're not up to that; follow us for risk management tips + trends.
minney69,ÜT: 51.083792;-120.180976,Mon Mar 16 16:49:17 +0000 2009,
jennyscribbles,Vancouver,Tue Sep 13 23:29:04 +0000 2011,Writer; Fashionista; Poet; Klutz...  My life is a comedy skit  www.jennyscribbles.com
BaillieIan,Vancouver,Thu Feb 17 21:42:55 +0000 2011,Executive Director of Vision Vancouver-- passionate about progressive politics!
jesswads,Vancouver,Sun Jan 25 23:03:41 +0000 2009,I love music; film; dancing; writing; hiking; gardening; swimming; travelling; politics; art and food. 
jeffrotin,Vancouver; BC,Wed Jun 01 01:42:05 +0000 2011,Facilitator; trainer; community builder. Avid cycling commuter. My summer home is Kits Pool. 
KimMack92,Vancouver,Tue Sep 13 20:51:29 +0000 2011,Parking Programs Supervisor; soccer mom and coach; plays/manages my ice hockey team and mixed slo-pitch team. Mom and wife.
alyski,Vancouver; B.C.,Tue Oct 14 15:41:16 +0000 2008,A lover of: photography; design; social media; travel; family; food; hammocks and sunshine.
tyler_bryant,,Tue Jan 12 20:56:34 +0000 2010,Energy Policy Analyst at the David Suzuki Foundation
NatalinaK,Vancouver,Sat Jul 03 21:29:18 +0000 2010, I wear glasses that make me look way smarter than I am.
BastianZeiger,Vancouver; BC,Mon Sep 12 21:32:56 +0000 2011,Bastian Zeiger - Director of Publicity    Canadian Association of Planning Students (CAPS) Conference 2012
AlanoEdzerza,Vancouver,Sat Mar 27 20:55:25 +0000 2010,Vancouver Tahltan artist - Interior and Graphic Designer. Located just off Granville Island.
Elia_White,Vancouver; BC,Sun Aug 21 10:07:51 +0000 2011,A lover of the outdoors & passionate about reading and food...
devotedforlife,Vancouver; BC,Mon Jan 24 23:43:42 +0000 2011,Lover of food; cooking and outdoors. Check it out at http://foodandpassion.blogspot.com
teachertong,Vancouver; BC,Sat Sep 10 07:18:09 +0000 2011,Home Economics teacher @ Surrey School District | Master of Education student @ UBC | Yoga Enthusiast @ everywhere
ShieldMasonry,Vancouver; BC; Canada,Mon Aug 08 12:57:11 +0000 2011,Residential & commercial masonry including restoration; building envelopes; stone work and landscaping. Providing services in Metro Vancouver and Area.
TheCyclingWolf,Vancouver; BC Canada,Sun Jul 10 15:14:04 +0000 2011,Avid road cyclist riding old school 12 speed Norco Avanti. I may not get there quick but I will get there.
GoldenGreatWall,705 West Broadway,Fri Sep 09 00:09:01 +0000 2011,We are a Family Operated Restaurant with Traditional Value and Modern Views. Call 604-873-9147 for Free Delivery; Take out; Questions; or Reservation.  
yukon_scott,ÜT: 49.32954;-123.02982,Tue Feb 09 04:45:24 +0000 2010,Whitecaps FC supporter; dad; CA and member of www.shlf.ca
AarmitaC,Vancouver; BC,Sat Mar 14 05:31:45 +0000 2009,PR student at SFU. Movie and TV junkie; event planner and avid reader.
MarcieTrevisan5,Austin TX 78723,Sun Jun 05 11:29:18 +0000 2011,
BusyBee_RRU,Victoria; BC; Canada,Mon Aug 22 22:36:09 +0000 2011,ALL PROCEEDS GO TO FOOD BANKS CANADA! Busy Bee is a 30 day project by Royal Roads University students. We aim to raise $1000. Check out our website and donate!
deleriyes,Vancouver; BC,Sun Jan 11 00:27:59 +0000 2009,// Deleriyes Designs || 'Our designs are delirious!' \\
whalesafaris,Tofino; BC; Canada,Thu May 14 16:34:33 +0000 2009,Book before the BEGINNING of our season and SAVE 20%  Use Booking code: NYE2012 
EarthFound,British Columbia; Canada,Sat Jul 31 16:19:55 +0000 2010,Earth Foundation uses large scale murals; school projects and public art to connect people; students and communities to the environment. 
TheDangerousExp,Vancouver BC,Mon Aug 29 21:42:14 +0000 2011,The Dangerous Experience is a Progressive Rock'n Roll Band from Vancouver BC. I Benjamin Dangerous play guitar and sing. Current Guitarist for @BadJohnnyLaw
Canucks_Dream,,Tue Sep 06 02:54:42 +0000 2011,Hi I'm a Canuck fan and i would like to meet the team; but i need ur help to do it. I live 5;045 Km away from Vancouver; read about my dream at  
GenYExcellence,Vancouver; Canada,Wed Jun 02 22:49:25 +0000 2010,Tweeting for Centre of Excellence for Young Adults (CEYA). We teach the  Insights Discovery Learning and Development Program.  Also tweet for @NextraOrdinary
DavidLalonde,ÜT: 50.122501;-122.95637,Tue Feb 17 19:19:22 +0000 2009,Father; Materials Engineer; Canucks and BC Lions fan. I work in technical sales and management for a supplier to the metal casting industry in Vancouver; BC.
PopaFatt,,Sat Aug 15 02:35:25 +0000 2009,Let's unite the world; one tweet at a time :)) Spred and share your knowledge! ONE LOVE 3
OlmaniDev,North Vancouver; BC,Tue Jul 05 20:28:37 +0000 2011,We are a full service kitchen; bathroom; deck; home renovation company and we are able to handle all aspects of your projects in and around Vancouver; BC.
Khanhharoy,Denmark,Mon Feb 01 03:09:04 +0000 2010,
HeyVancouver,Vancouver; BC; Canada,Fri Aug 12 18:15:25 +0000 2011,HeyVancouver! So much to see & do in Vancouver - big shows; open mics; comedy nights little hidden gems and greasy chopsticks. Looking to enjoy them them all.
LanesideDesign,Vancouver BC,Wed Mar 09 06:50:59 +0000 2011,A custom laneway home design company working in the greater Vancouver area.
jenscott47,,Wed Apr 06 04:18:21 +0000 2011,Freshly minted Vancouverite. Loves sports (the politics; more than the scores). Running partner to 2 dogs. Emotionally dependent on cheese; chocolate & 30 Rock.
alisonesc,Vancouver; Canada,Thu Feb 10 19:01:55 +0000 2011,Geography lover. Traveler. Outdoor Explorer. Adventurist. Enthusiast.   Interests: Enviro Education - Sustainability - Pilates - Cheese & Wine    
misandi,Vancouver BC Canada,Mon Jun 22 13:58:02 +0000 2009,Random Acts of Kindness can bring joy & happiness to the lives of many. Lets make the world a better place. Spread PEACE; LOVE & JOY wherever you go~♥  
roseofeurope,Vancouver; BC,Tue Jun 30 12:14:29 +0000 2009,♕ℐudge my ℋeart♕   Christian; biracial; Third Culture Kid; traveller; @queensu & @UniHeidelberg alumna; @RunForChange volunteer coordinator. A ♡ for people.
kianaheighton,,Mon Nov 09 20:18:39 +0000 2009,
SarahSaysStuff,Vancouver; BC Canada,Sun Jan 31 06:54:22 +0000 2010,Event Planner (9-5); Adventurer (5-9) and All Around Crafty Gal (24/7). I like pugs and gardening and tv and food; but not necessarily all at the same time. 
angelawong_,vancouver,Tue May 26 14:22:04 +0000 2009,marketing manager with a thirst for adventure and a hunger for all things food; travel; culture; design and social change. i heart good coffee and chocolate.
24hoursvan,Vancouver; B.C.,Tue Nov 04 21:53:55 +0000 2008,24 hours Vancouver newspaper at your service! 
mdayw,vancityyyyy,Sat Mar 21 05:50:37 +0000 2009,spread love; happiness; & peace
BCBusinessBeat,Vancouver,Wed Aug 17 16:47:40 +0000 2011,BCBusinessBeat.com takes an independent look at business; economy; career. Join the discussion.
hraisinghani,Surrey,Sat Dec 12 06:31:01 +0000 2009,B.A.Sc. Engineering Physics - UBC '06; Educator; EWB Advocate
JohnLee594,,Wed Aug 24 05:34:04 +0000 2011,
birdonawireart,2535 Main St.; Vancouver; BC,Fri Dec 18 20:02:12 +0000 2009,Bird on a Wire Creations  Where ideas soar; and creativity takes flight  We are a store that consigns arts/crafts of the highest quality. 
sellinvancouver,Vancouver,Tue Nov 16 05:33:27 +0000 2010,Offering great advice on selling properties in Vancouver; renovation tips; and value added ideas that you can rely on.    Your friend in Vancouver Real Estate
mostlydana,Vancouver; BC,Mon Jan 19 05:11:58 +0000 2009,Enjoys a car- and cable-free lifestyle and being outside. Communications coordinator for a professional association. 
FrontlineRE,Surrey and Langley BC,Tue Sep 07 23:42:50 +0000 2010,Frontline Real Estate Services is a full service real estate firm specializing in the Surrey – Langley market.
TraumaScnClnUp,Vancouver; Canada,Wed May 12 05:40:01 +0000 2010,The first premier biohazard cleaning and restoration company in British Columbia that specializes in the cleaning of trauma; crime and bio-hazardous incidents.
envtsustainvan,Vancouver,Mon Feb 16 23:26:45 +0000 2009,4th yr ubc envt & sustainability. I love living in this city! #sust; urbanomics; urban planning; #bcpoli. 
AlleyHealthFair,DTES; Vancouver,Mon Aug 15 20:20:32 +0000 2011, aims to increase awareness of healthy living possibilities among DTES residents; particularly those who do not access health services.
pastrytraining,Vancouver,Sun May 16 22:19:54 +0000 2010,Where passion meets knowledge  Professional training program with a timeline that fits your schedule and budget
