screen_name, location, created_at, description
CdnClubVan,Vancouver; BC,Fri Feb 24 00:52:22 +0000 2012,Fostering fellowship among people and encouraging the celebration of Canadian identity.
AndersFalk2,1008 Homer Street Vancouver BC,Thu Aug 04 18:01:47 +0000 2011,
DTESGreenWaste,Vancouver,Tue Dec 07 03:10:03 +0000 2010,We're a social enterprise in #Vancouver’s #DTES. Specializing in #Hoarding #Cleanup; #Junk Removal; #Recycling & #Garbage Pickups across Vancouver; we donate!
PeopleTreeLearn,,Sun Mar 11 04:57:10 +0000 2012,
Katreenaw,,Fri Feb 03 21:39:43 +0000 2012,
mike_schneider_,Tsawwassen British Columbia,Sat Apr 25 01:20:34 +0000 2009,Drupal developer; writer and long time #blogger commenting on life; #politics and lately; #farming; #edu and land use. Opinions and observations are my own.
Green_ByAdera,7488 Byrnepark Walk; Burnaby,Thu Feb 17 17:37:04 +0000 2011,Green is a collection of one; two and three bedroom homes created to promote energy conservation and healthy; sustainable living for families and the community.
NEXTEnviroBC,Burnaby; BC; Canada,Tue Feb 14 07:19:41 +0000 2012,We are specialists in contaminated sites investigation and remediation; based in Burnaby; BC.  
sunflower_sk,,Thu Mar 17 21:08:16 +0000 2011,
urbanracks,Vancouver; Canada,Sun Dec 25 02:25:02 +0000 2011,Urban Racks offers a wide range of innovative bicycle parking solutions and related services throughout North America. 1.888.717.8881
BCConstructionA,Victoria; BC,Wed Feb 29 21:44:03 +0000 2012,Official BCCA Twitter page. Non-profit provincial voice of the construction industry.  Tweeting industry info helping those who build BC.
MovieYearbook,Vancouver,Tue Nov 29 01:10:56 +0000 2011,One man's insane mission to review a theatrically released film a day for an entire year! Reviews posted daily! Fanboy; critic; freelance writer.
Chantel_Dawn,Vancouver CA,Sat Jun 26 06:53:17 +0000 2010,#Tourism Sales&Marketing professional. I have love for Boutique hotels|Travel|Fashion|Restaurants|Communication|Innovation|Goodthings. Smitten with Sinatra 
Senz_Says,Canada,Wed Mar 11 18:48:37 +0000 2009,Work is part of my life. Some are not so fun to do. But important for a healthy safe environment I create for myself. I like been creative in my thinking.
hello_charity,Vancouver,Sat Mar 03 21:46:04 +0000 2012,If you smile to the world;the world will smile to you.
VinciParkCanada,Canada Place; Vancouver,Thu Nov 10 22:51:07 +0000 2011,VINCI Park at Canada Place is part of the world's largest parking corporation; VINCI Park
MMCDAssoc,Vancouver; BC,Mon Aug 17 06:02:01 +0000 2009,We love civil engineering; municipal infrastructure; and all things construction.  MMCD - Your documents of choice for BC infrastructure projects!     
IAMTONY1,Vancouver/London/LA,Sun Mar 04 22:48:56 +0000 2012,CEO blackpointcapitalgroup Sports& fitness fanatic. sun worshiper;Devoted Canucksfan;basketball;ufc. Living in Best Place on Earth. A Proud father♥  
SeaWallAgency,Vancouver; BC - Canada,Sat Mar 03 22:29:02 +0000 2012,Sea Wall Agency
urbngreen,West Coast British Columbia,Thu Jun 30 05:29:13 +0000 2011,I live in New Westminster; British Columbia. I write about activism; alternative education;gardening;art and nature. 
SFUPublicSquare,British Columbia,Tue Jan 10 00:33:35 +0000 2012,
MacCanada,Edmonton; Alberta; Canada,Tue Mar 20 07:32:01 +0000 2007,Links; Thoughts; Discussion; Communication… Tweet!
Divorce_Shop,All over BC,Mon Oct 31 00:25:07 +0000 2011,$295 Joanne's Uncontested Divorce Shop Inc BC and http://.joannesreidealboard.webs.com We donate 10% to God; single mothers and kids.
chelaland,,Sun Apr 19 05:36:26 +0000 2009,World Traveller/Shopaholic/Dreamer/Chip Addict/Environmentalist  
robchantler,Vancouver; BC,Sun Nov 14 23:16:07 +0000 2010,Vancouverite.
SatelEnt,Vancouver; BC; Canada,Tue Aug 23 01:41:27 +0000 2011,Satel Enterprises Ltd. is a software consulting/development company.
VanCentreNDP,Vancouver; BC,Tue Aug 30 07:41:55 +0000 2011,Vancouver Centre New Democrats: we invite you to become a member of the NDP and join us as we support and celebrate the people of Vancouver.
BESTCARSBC,Vancouver Canada,Sat Sep 03 00:30:01 +0000 2011,I'm your needed honest car sale consultant. For best price and service please contact me.    SATISFACTION GUARANTEED     FINANCE - LEASE 
Rocalyne,,Wed Oct 21 01:31:02 +0000 2009,
BCEIA_,Vancouver; BC; Canada,Fri Jun 17 17:47:50 +0000 2011,Most recognized and longest running professional business association dedicated to member companies that operate in the many sectors of environmental business.
GerryTMcGuire,Vancouver;Canada,Sat Jan 17 14:36:10 +0000 2009,Father;entrepreneur;photographer;artist; political pundit and proprietor of A-Ace Limousine Incorporated in Vancouver;BC.  604-961-9123
andrealcaesar,Vancouver,Fri Jun 17 19:33:22 +0000 2011,Passionate Vancouverite. Meetings & Conventions Associate at @myvancouver (LOVES) traveling; people; climbing mountains; wine; trail running; @yyoga & coffee
uprisingbreads,Vancouver,Mon Jan 24 14:11:02 +0000 2011,Baking tasty; whole grain; honey-sweetened bread & goodies for 35 yrs in Vancouver; BC. Two bakery/cafés: 1697 Venables & 3066 W Broadway www.uprisingbreads.com
Paulyy_P,Vancouver,Sun Jul 03 03:39:43 +0000 2011,Peanut butter junkie.
CivlNews,Fraser Valley; BC,Thu Sep 08 18:11:12 +0000 2011,A daily feature on @CIVL_Radio updating listeners and followers on local; national; and global news. Listen at 101.7 FM or www.civl.ca.
SeanThor16,Richmond BC,Sun Apr 26 16:33:03 +0000 2009,
fonikdesign,Vancouver,Mon Oct 11 06:26:55 +0000 2010,1/2 heart of Fonik Design. Web/Graphic Designer. D&B Aficionado. Lover of Life & Grilled Cheese Sandwiches.
KlahowyaVillage,Vancouver; BC; Canada,Mon May 02 15:50:57 +0000 2011,Klahowya Village in Stanley Park is an authentic Aboriginal cultural tourism attraction providing cultural tours; the Spirit Catcher Train Ride and more.
WaiLui,Vancouver; Canada,Fri Jun 19 08:46:26 +0000 2009,The misc ramblings of an up-&-coming Vancouver-based designer on art; architecture; design; music; travel; fashion; food; business; media; technology & culture.
OddballWorkshop,Vancouver; BC,Sat Jan 01 22:30:43 +0000 2011,We make you look good! A Promotions Co. specializing in digital printing: custom tees; stickers; banners; etc. If you can think it we can run with it!
BitCase,Vancouver,Tue Dec 28 23:13:44 +0000 2010,Web Design | Content Management | Ecommerce | Web Hosting | Web Development 
jacsrons,Whitehorse,Fri Sep 10 01:26:26 +0000 2010,UBC journalism student. Explorer. Dancer. Lover of music; food; bikes; scrabble and the North. Former intern @CBCRadio3. Intern @CBCNorth; Whitehorse.
Miss604,Vancouver,Sat Mar 10 21:16:02 +0000 2007,Vancouver blogger; WordPress dev; owner of @sixty4media with @JohnBollwitt & published author. Columnist; world traveler; Canucks fan.
avanbaarsen,Vancouver; BC,Tue Sep 30 20:23:04 +0000 2008,
PL__Web,Vancouver; BC; Canada,Thu Oct 28 23:42:16 +0000 2010,Sharing today's news; tips and tricks in the world of Web Development and Social Media.
Deannaz88,,Sat Apr 18 04:59:37 +0000 2009,
DimitryMorales,ÜT: 49.264358;-123.138574,Wed Aug 05 11:08:49 +0000 2009,Proud father of Princess Olive and world citizen that dabbles in many things to make a positive change in this world.
alittlemoregood,Vancouver; British Columbia,Wed Jun 16 08:40:19 +0000 2010,A Little More Good was founded on one simple idea: promote the good. Profiling ideas; causes; and companies that are making a difference in Vancouver
VisionVancouver,Vancouver; BC,Fri Jan 29 00:10:14 +0000 2010,Committed to ending homelessness; building a green economy; and investing in creativity & innovation. Together we are improving life in Vancouver.
Spennynub,British Columbia; Canada,Wed Feb 25 06:10:35 +0000 2009,@SFUBeedie HR/Marketing student. Love social media; volunteering; music; urban planning and the outdoors. Every day is an opportunity for a new adventure.
waldorfhotel,1489 Hastings; East Vancouver,Thu Jul 08 22:52:25 +0000 2010,After 63 years in business; the Waldorf Hotel has reopened as a multi-venue concept hotel.
GreekDay,Vancouver; BC,Fri May 22 15:07:02 +0000 2009,Sunday June 26th - Vancouver's Largest Enclosed Street Festival www.greekday.com for details 
lisagfisher,Vancouver; BC,Wed Nov 19 18:06:54 +0000 2008,Brand Manager at UBC; mom; grad student; hockey fan. This is my personal account.
rj_aquino,Vancouver,Tue Apr 17 02:50:18 +0000 2007,Fresh Father. Roots In Reason; Branches In Diplomacy; Leaves You Breathless. Manila Original. Filipino. Canadian.
SUVCC,Vancouver,Mon Sep 13 22:33:01 +0000 2010,Students' Union of Vancouver Community College  Local 73 of the Canadian Federation of Students
nredmond,Vancouver; BC,Fri Sep 07 13:52:44 +0000 2007,Interactive Marketing & UX Manager. ♥ design; digital media; innovation; storytelling; analytics; film; photos; music; travel; environment;  outdoors & sports
slowfade,Vancouver; BC Canada,Sat Jan 27 23:22:06 +0000 2007,Love all (well most) things tech; music and photography
totochow,Richmond; BC,Thu Apr 15 06:36:52 +0000 2010,
climatesmart,Vancouver; BC,Tue Jan 20 20:54:25 +0000 2009,Cut costs! Cut carbon! We empower & enable small & mid-sized businesses to strengthen their businesses & build a more resilient economy. Tweets from Beth&Lloyd.
orcasislandtv,Eastsound; WA,Thu May 27 01:47:43 +0000 2010,Send tips and information to Orcas Island TV! OI TV - Local Events; Sports; Fun from Orcas Island.. 
BigBrosOnline,Lower Mainland,Thu Jun 11 16:56:40 +0000 2009,Vancouver-based charity that offers friendship-based mentoring programs and volunteer opps for men and women. 
amygibson,Vancouver,Tue Aug 12 14:07:05 +0000 2008,East Van resident; graphic designer; photographer knitter; curler
lizsperandeo,Vancouver; B.C.,Fri Feb 27 16:54:51 +0000 2009,PR Manager promoting tourism + hospitality for @SpectacularInk. @DFSVancouver advocate + Board Member. Brunch addict; travel lover and loud laugher. 
djdimitri_gr,Vancouver;  Canada,Mon Mar 23 08:12:32 +0000 2009,international Dj - Promoter - Music Programer 
OutSmarts,British Columbia,Fri Mar 09 18:40:06 +0000 2007,Smart Internet Marketing.   
KeithIppel,Vancouver,Tue Feb 16 20:24:53 +0000 2010,@Invoke @CauseAffect @BikeshareBC @Foodee - Career ADD & loving it
EricGWan,Vancouver; Canada,Sat Feb 07 08:14:01 +0000 2009,Theology; Evangelism; Civil Engineering; Planning/Transportation; Land Use; Rowhomes; Cycling; Hiking; Traveling; China; Indie Folk Music; Farmer's Market.
TripsForKidsVan,Vancouver,Tue Apr 27 16:01:46 +0000 2010,TFKVan is a registered non-profit organization that aims to make a positive impact on the way at-risk youth view their community; the environment & themselves. 
VanObserver,Vancouver; BC,Sat Nov 15 18:15:22 +0000 2008,Journalism matters.
RobCottingham,Vancouver,Tue Oct 24 04:25:30 +0000 2006,Social media enabler (@socialsignal).  Noise to Signal cartoonist (@ntos). Humorist. Speaker.  Sweetie of @awsamuel.  Believer in the wide-open web.
Vida_Jay,Vancouver; BC Canada,Mon Jan 04 08:30:34 +0000 2010,Student of the human condition; pilgrim in search of the heart of life where justice and mercy meet; Lutheran pastor working as a healthcare chaplain.
DuncanWlod,Vancouver,Wed Jun 09 16:41:14 +0000 2010,Executive Director of Sustainable SFU. Tweeting about the the climate; energy; cities; politics; the planet; and democracy. 
ashiqahamed,Vancouver; Canada,Tue Mar 11 22:37:29 +0000 2008,
energy_matters,Region of Peel; Canada,Tue Feb 02 23:09:35 +0000 2010,Leading Public Sector Energy Management Conference - May 28 & 29; 2012 @ The Toronto Congress Centre; Toronto; ON Canada.    
sengsengsavanh,Richmond/Vancouver,Wed Oct 14 16:50:53 +0000 2009,Husband; father; designer; educator (ID Director @ AIV) & columnist. Passionate about life-long learning; good design; good food; travelling and photography.
anthonyctaylor,Vancouver Canada,Sun May 10 17:14:47 +0000 2009,Working on turning a BBA into an MBA. I help small business owners grow. Sports; food; nightlife and language make my life fun. Go bears!
aimeearama,Vancouver,Thu Mar 05 19:40:13 +0000 2009,eat; sleep; breathe: tourismmmmmmmm   : rarely linear
crisiscentrebc,Vancouver; BC,Mon Jun 22 20:25:59 +0000 2009,Helping people help themselves and others deal with crisis. Distress Line: 604-872-3311. 1-800-SUICIDE. Web-Hotline: YouthInBC.com.
BW_Creative,Vancouver; BC,Tue Nov 10 18:47:06 +0000 2009,Marketing | Branding | PR
rvossepoel,Vancouver; BC,Sat Dec 12 22:59:34 +0000 2009,Interested in all things sustainability; marketing and project management related
KristenThom,Toronto,Tue Apr 21 01:38:36 +0000 2009,Associate Managing Editor at Metro. Vancouverite/Torontonian. I'm the punctuation; police. (views are my own)
dewert,Vancouver; BC; Canada,Tue Feb 24 06:01:43 +0000 2009,Ecology student at UBC who's interested in typewriters and just about everything else
kalinhop,Vancouver,Fri May 01 06:11:43 +0000 2009,crafts; beauty and tofu.
mandablemac,vancouver bc | canada,Thu Jun 11 05:05:10 +0000 2009,Group Marketing + Communications at Wesgroup Properties. An observer of all things and captain of the road less traveled.
chickievan,vancouver; bc,Tue Jan 26 05:46:38 +0000 2010,a coffee sleeve connoisseur who infosnacks on mobile + social + #measure
rcc_heritage,Vancouver; BC,Sun Jul 26 00:23:15 +0000 2009,The mission of Renfrew-Collingwood Community Art Gallery and Museum is to support the beneficial inclusion of fine art and history into community life.
bartdebaere,Vancouver/Europe,Tue Nov 25 04:30:23 +0000 2008,Geek. Yogi. Avid traveller. PhD student @UBCGradSchool. Volunteer @YouthCo. Lover of cute dogs and pain au chocolat snob. Favours hugs over handshakes.
colbeaner,Vancouver; BC ,Wed Feb 25 04:21:02 +0000 2009,
KudosKvetches,Vancouver,Thu Jan 28 22:03:19 +0000 2010,Sharing the love
GalaxyPlumbing,Burnaby; BC,Fri Feb 20 17:40:36 +0000 2009,Plumbing Drainage & Heating Contractor; Servicing Greater Vancouver and the Lower Mainland
G3OP,Vancouver,Mon Feb 09 07:19:35 +0000 2009,I am a writer. Here is my pen.
iheartcities,Vancouver; BC,Wed Jun 17 18:55:53 +0000 2009,urban enthusiast; public engagement specialist; sustainability nerd; music lover & knitter. #publicengmt
kpapp,West Vancouver; BC,Wed Oct 29 15:13:27 +0000 2008,marketing communications specialist at bc hydro / wife / lover of life
CorrinSkalbeck,Vancouver BC,Mon Dec 14 23:21:03 +0000 2009,Producer/Host; RRU student; Orb Girl;adventure travel aficionado; vegetarian; environmentalist;canine obsessed-adopt a pet from the BCSPCA!
kathiewallace,Rocky Mtn House;  Canada,Mon Jan 05 19:34:13 +0000 2009,I am a community engagement facilitator who is passionate about bringing everyone to the table as equals on a level playing field.
d_everett,Vancouver; BC,Fri Jul 11 18:26:17 +0000 2008,the complete opposite of kitsch
parkinnvan,898  West Broadway,Sun Oct 11 18:22:33 +0000 2009,With probably the best views of the city; in a central location; the Park Inn & Suites Vancouver Broadway is the ideal starting point to explore the city.
rmountaineer,Vancouver; BC Canada,Wed Dec 10 20:09:53 +0000 2008,The world's leading travel experience by train! Tweeting from our head office in Vancouver; BC. 
erikoarai,,Sat Jul 25 22:43:35 +0000 2009,Mountain lover working with non-profits & businesses creating social good. Tweets about conservation; socially conscious business practice; science & education.
shawnalum,Coquitlam; B.C.,Fri Dec 11 09:09:56 +0000 2009,Recreation Coordinator. Non-profit leader. Health promotion enthusiast.  Bootcamp teacher. Challenge seeker. 
jl_d,Vancouver,Tue May 13 05:47:39 +0000 2008,Communicator @sportbc;@IABCBC. Interests: youth & civic engagement; community building; sport. Loves: a good story & an adventure; everywhere & anywhere
BoffoProperties,Vancouver; BC,Fri Nov 20 21:23:09 +0000 2009,Multi-disciplined developer founded on family principles. Brother/sister duo leading with honesty; integrity; hard work. Tweets by @danielboffo + @marissa_elise
SkyTrainLady,Burnaby; BC; Canada,Sun Dec 21 18:39:05 +0000 2008,I love talking about trains; transit & my hometown; Vancouver. My title: Communications Liaison; BC Rapid Transit Co. For transit service info folo @TransLink. 
theprovince,Vancouver; B.C.,Thu Sep 18 04:21:32 +0000 2008,Online companion to Vancouver's daily tabloid; The Province. The web team manages our Twitter account.
jminter,Vancouver; BC,Mon Feb 09 06:19:33 +0000 2009,Airline Marketing Director;   Indecisive Gemini: I try to see it all On The List checking out Sounds; Sights; Sports; Socializing  Tweets are my own opinions.
PlayhouseWine,Vancouver; BC; Canada,Wed Apr 15 20:29:41 +0000 2009,34th @VanPlayhouse International Wine Festival; Feb 27-Mar 4; 2012. Theme: CHILE. Focus: Cabernet(s). Canada's premier wine show. Tickets/Info: 1.877.321.3121.
camera_junkie,Vancouver; BC,Mon Aug 10 21:14:22 +0000 2009,Filmmaker; Photographer; Tech Junkie; Camera Junkie and Movie Fanatic who loves food; music; ecotourism; current events & conspiracy theories 
Synergist_Inc,Vancouver/Edmonton,Thu Mar 26 23:06:40 +0000 2009,Award-winning; results-driven creative & strategy helping places & companies manage perceptions; live & share powerful brand stories with pride & conviction!  
Stv,Vancouver,Fri Dec 01 23:43:25 +0000 2006,Partner & Technical Lead at Pencilneck Software. Dad; comics-nerd; indie-music hound; ultimate player. ThinkCity Board Member.  I AM NOT A TV STATION!
BobRansford,Vancouver Canada,Tue Jan 05 20:05:26 +0000 2010,Communications;public affairs & urban development specialist at COUNTERPOINT Communications Inc.New urbanist designer and writer.Steveston Canada resident.   
SteveWooBCN,Vancouver; BC,Sun Apr 05 14:26:00 +0000 2009,Notary Public; serving the Chinatown community and surrounding areas.Vancouver; BC.
CityCaucus,Vancouver BC Canada,Tue Dec 02 06:11:49 +0000 2008,Dialogue with a difference. Political analysis & news with an edge from Canada's Pacific metropolis. See also @MikeKlassen & @Fontaine_D.
HealingPod,Vancouver,Mon Apr 13 16:38:24 +0000 2009,Connect. Share. Heal
RobsonStreet,Robson Street; Vancouver; BC,Thu Feb 26 19:51:38 +0000 2009,Robson Street is Vancouver's most famous shopping street set in the heart of downtown Vancouver. Follow to be updated on happenings of the street!
ScienceWorldTR,Vancouver; B.C.,Tue Aug 18 20:28:25 +0000 2009,Science World British Columbia Teacher Resources - tweets moderated by Kate Henderson; science teacher. Science World is also tweeting from @scienceworldca 
IFestCanada,,Sun Dec 06 03:45:36 +0000 2009,Langley International Festival
lwong76,Vancouver; BC,Fri Oct 09 23:50:34 +0000 2009,Passionate about life; running & events!  Race Director to Vol Coord; i've done it all - specializing in mktg/sponsorship - always looking 4 a challenge! DM me!
bc_living,Vancouver; BC; Canada,Tue Sep 16 23:32:58 +0000 2008,The voice of bcliving; exploring the lifestyles and interests of Metro Vancouver and the province of British Columbia.
SauderISIS,Vancouver; BC,Tue Apr 07 20:29:17 +0000 2009,ISIS; Sauder School of Business; UBC.   'Advancing social innovation and sustainability’ 
ChanCentre,Vancouver; Canada,Fri Jan 30 00:36:51 +0000 2009,Music lovers and marketers; Rachel Lowry and Claire Mohun chirp for the Chan; a world-class performing arts centre located on the campus of UBC-Vancouver. 
dennisworld,Vancouver; BC,Fri Mar 23 21:38:00 +0000 2007,Everything green; Traveling; Mobile Internet; Photography; Hiking; Ultimate; Snowboarding; Opportunistic vegetarian; Sailing; Biking; Diving; Audiobooks
Jesswakeman,Vancouver; Canada,Tue Mar 10 23:04:55 +0000 2009,I'm into music; tech; marketing; & online brand strategy. Oh and I work in marketing at @HootSuite
cyclevancity,Vancouver; BC,Mon Jan 19 13:14:00 +0000 2009,Daily bicycle tours in Vancouver BC!   Unique experiences; storyteller guides; hidden gems; beautiful routes; social issues; ecology; food; bike advocacy; FUN! 
stephenhui,Vancouver,Thu Jul 31 23:40:16 +0000 2008,Web editor and technology editor at the Georgia Straight. Email shui@straight.com. http://www.straight.com/
MacKenzieCam,Vancouver,Mon Jul 20 19:43:00 +0000 2009,I am an expert in executive education & professional development and lead the online professional development team at CGA-Canada. 
thebuzzer,Burnaby; BC,Tue Jan 13 21:25:49 +0000 2009,I'm Robert Willis; editor of the Buzzer: Vancouver's free transit newsletter since June 2; 1916. (Follow @translink for key transit updates!)
jmv,New West; British Columbia,Wed May 23 14:35:01 +0000 2007,Curator of http://illustratedvancouver.ca/
envirodefence,Canada,Tue Oct 27 15:51:19 +0000 2009,Environmental Defence challenges; and inspires change in government; business and people to ensure a greener; healthier and prosperous life for all.
h_mllr,Vancouver,Fri Mar 02 05:45:20 +0000 2012,Vancouverite; writer; environmentalist and care giver to a composter full of worms. 
mattsayswhat,Vancouver,Wed Apr 01 05:06:30 +0000 2009,Recent @SFU alum in Marketing and Film Studies. Digital production @thisisdareNA. Travel enthusiast. Music lover. Avid power napper. 
gordonr,Vancouver; BC,Thu Oct 26 22:03:59 +0000 2006,VP/Partner of OpenRoad; 17 year old Vancouver web firm; creators of ThoughtFarmer. Spem successus alit - success nourishes hope. 
paulhillsdon,Vancouver; Canada,Thu Mar 08 10:32:50 +0000 2007,Architect of the future. Tweeting live since 2007. 
CWFMrobson,Vancouver British Columbia,Thu Jul 17 18:08:20 +0000 2008,
MonasLebanese,1328 Hornby St. Vancouver,Sat Nov 21 12:29:25 +0000 2009,Vancouvers best Lebanese restaurant offering great food and a dj & bellydancer on weekends
WatertigerBC,Vancouver; BC,Thu Nov 17 19:17:57 +0000 2011,Water purification and rainwater harvesting. We are your Total Water Solution! Service in BC; shipping all over the world.
vpsn,Vancouver; BC,Sun Apr 26 23:38:09 +0000 2009,The Vancouver Public Space Network is a grassroots; volunteer collective engaging in advocacy; outreach & education on public space issues in Vancouver. 
anncheng,,Sat Apr 11 10:06:23 +0000 2009,
rtanglao,Vancouver; British Columbia,Tue Jan 23 06:47:35 +0000 2007,create compelling content constantly! - do it!
EllenYeung,Vancouver; B.C.,Mon Dec 15 07:21:47 +0000 2008,I'm particularly interested in stories about creativity; community development; and media.
MichaelSSU,Vancouver; BC,Mon Jul 11 17:02:29 +0000 2011,Big fan of Social Media; Webinars; QR codes; Food; and Vancouver!
drjotisamra,Vancouver; BC; Canada,Thu Jul 29 03:18:33 +0000 2010,TV Host;OWN (Oprah Winfrey Network);Clinical Psychologist;Organizational & Media Consultant;Columnist; Speaker;Author;Researcher;Workplace Mental Health
ride2rio,Vancouver; BC,Sat Dec 17 19:11:19 +0000 2011,@NaomiDevine - I'm riding my bike (+ train; etc) 11 200 km from Vancouver to Rio+20 from February to June 2012. Follow my journey and share with others here. 
VC_Ocean,,Mon Feb 27 22:28:49 +0000 2012,VP-Internal at Young Liberals of Canada in BC. SFU student. Earth warrior. Current events junkie. Animal lover
homelessaction,Metro Vancouver; BC Canada,Wed Jun 24 00:57:42 +0000 2009,Greater Vancouver Regional Steering Committee on Homelessness
prog_grooves,Vancouver,Thu Feb 16 03:41:08 +0000 2012,Official Twitter of Progressive Grooves Records - news on our #music releases; #artists; @TranceClass and label head @DJ_Mikas;  . #TranceFamily #Vancouver
LMoffatt,Vancouver,Sun Apr 18 19:33:54 +0000 2010,Community planner; bike polo-ista; amateur photographer; happy traveler
CamaraEcuaCanad,Guayaquil - Ecuador,Wed Jun 01 23:11:37 +0000 2011,La Cámara de Comercio Ecuatoriano Canadiense de Guayaquil es una organización de derecho privado; sin fines de lucro; conformada por compañias y particulares. 
MarlaGuloien,Vancouver; Canada,Tue Jun 09 06:13:52 +0000 2009,Singer. Producer. Film & Design. Love. Hard work and passion culminating into one... the beautiful life. https://www.facebook.com/marlaguloien.music 
burrowingsnow,Vancouver; BC; Canada,Sat Mar 12 23:02:25 +0000 2011,A wise old Canadian digging into the deep depths of technologies for the Oracle and Apple Developers
JRad_33,Vancouver; BC,Mon Aug 30 16:44:07 +0000 2010,Past: Pro Football Player               Present: Business Strategist               Future: Successful Entrepreneur   Always: Grindin'
JJMacLean,Vancouver; BC,Tue Sep 04 18:02:13 +0000 2007,Not just your everyday overachieving college student; working towards degrees in Economics and Chemistry at UBC.
icompasstech,Kamloops; BC,Fri Jul 17 23:14:11 +0000 2009,iCompass provides CivicWeb; the leading Meeting and Records Management Solutions for busy government and education professionals.
FreeTalkTV,Vancouver; BC,Wed Dec 07 08:09:31 +0000 2011,Free Talk is a Local TV series exploring the important issues facing residents of the Vancouver area.
GILibertywine,Granville Island Vancouver,Tue Jun 16 21:58:40 +0000 2009,Liberty Wine on Granville Island; worth a visit!
AmandaLeeL,Coquitlam; B.C.,Tue Jan 31 04:10:02 +0000 2012,Sales Rep for Big River Restaurant & Tap House and The Zone Bowling Centre. Contact me if you'd like to discuss any group bookings. amanda@zbowl.com 
INTCROWDMGMT,Vancouver; BC,Thu Nov 10 21:59:24 +0000 2011,Our mission is to provide patrons with the safe; secure & friendly environment that they expect & require to maximize enjoyment of events & minimize risk. 
DiyoboVancouver,Vancouver,Thu Feb 02 17:30:00 +0000 2012,Need to sell your event tickets? Try Diyobo.com! Any event; Any size. Now online with Visa; Mastercard and Interac. You click it; we ticket.
chantelsstuff,,Thu Feb 16 17:25:00 +0000 2012,
MicroMixUSA,,Tue Feb 07 13:05:32 +0000 2012,Ergofit USA is pleased to introduce the Ergofit MicroMix product line; a powerful tool in environmental remediation and agricultural biotechnology. 
PR_Associates,Vancouver,Wed Nov 18 21:44:54 +0000 2009,PR_Associates is a #mining -focused communications firm with the tools and expertise to build and implement programs geared towards #sustainability
