SpokesVancouver,Vancouver BC,Mon Dec 14 20:37:25 +0000 2009,Spokes offers the best way to experience Vancouver; by bike of course! Explore beautiful Stanley Park and VanCity in a healthy; green and fun way.
YourCityHeating,Vancouver B.C. Canada,Thu Dec 30 00:05:39 +0000 2010,Gas Furnace; Heat Pump; and HVAC specialists   sales@yourcityheating.ca   604.467.4328  
BCLesClefsdOr,Vancouver,Sun Nov 28 03:37:51 +0000 2010,BC Les Clefs d'Or is an organization that represents Hotel Concierges. We facilitate the exchange of ideas between Members. 
Jenn_A_88,Vancouver; BC,Thu Jan 14 06:49:18 +0000 2010,book reader; coffee drinker; ocean lover; sunset watcher; living life to the fullest; laughing as often as possible & loving will all I've got.
Projects604,Vancouver,Fri Oct 15 20:21:04 +0000 2010,Consulting Company focusing on; Event; Facility and Pavilion Management|Business and IT Strategy Consulting|  Community Development
kitslove,Kitsilano; Vancouver,Sat Oct 30 21:45:34 +0000 2010,Inside Sales with Trialto Wine Group; love great wine and food.
lindsay_noyes,Vancouver; BC,Tue Apr 06 22:16:38 +0000 2010,President 2011-2012 SIFE BCIT Marketing Management Communications @BCIT  @VancouverBOT mentee and volunteer
SBIA_GreenZone,Strathcona | Vancouver; BC,Thu Jun 24 18:15:15 +0000 2010,
LynnCanyonPark,North Vancouver,Wed Jun 17 05:38:11 +0000 2009,Lynn Canyon Park and suspension bridge is located in Lynn Valley of North Vancouver British Columbia.
BigTimeTours,Vancouver; BC,Fri Feb 05 19:28:55 +0000 2010,An online tourism community for businesses and adventure writers to connect with the online traveler. http://bigtimetours.com - http://facebook.com/bigtimetours
leo_ng803,Port Coquitlam,Sun Jan 02 06:55:07 +0000 2011,3rd year HR + Marketing fanboy & current PM for @SpringSoiree under @SFU_HRSA; Leo is always swamped with involvement at @SFUBeedie. Learn & do good in life!
wongmon,,Tue Aug 04 20:03:26 +0000 2009,
CasinoEdgewater,Vancouver; BC,Fri May 21 22:57:04 +0000 2010,Vancouver’s Premier Downtown Casino!  Just steps away from BC Place; Edgewater Casino has entertainment 24/7. Know your limit; play within it. Must be 19+
deedhaliwal,north shore vancouver,Fri May 22 18:49:54 +0000 2009,Love North Van & live here; North Shore News Sales/Marketing;Community Volunteer;Mum;Artist;Sommelier&enjoy politics from the sidelines! Tweets are my very own.
carolynreardon,Halifax,Sat Apr 10 01:24:34 +0000 2010,Either coast will do; but the east one for now..
willkidsmusic,Vancouver,Wed Aug 12 20:07:48 +0000 2009,Bilingual children's musician; dad and former teacher from Vancouver. New album called Walk 'n' Roll out last November; it will knock you kids' socks off!
saragraves,Vancouver,Wed Jan 28 23:13:56 +0000 2009,humanitarian; CSRadvisor; & global citizen; who's learning that happiness; & a commitment to making the world a better place; are by no means mutually exclusive
vancouver125,Vancouver,Thu Nov 11 03:03:35 +0000 2010,Celebrate Vancouver's 125th anniversary and year as a Cultural Capital of Canada in 2011. 
ClarksAV,Vancouver; BC; Canada,Thu Sep 10 22:44:11 +0000 2009,Clark’s goal is to maintain the most exacting standards of professional practice and to exceed our clients expectations in all areas of Audio Visual services.
krisetches,Vancouver,Tue Jun 08 08:07:54 +0000 2010,Vancouver communications pro back from Asia and interested in a mix of sustainability services; community outreach; and marine; rail; and public transportation.
scottthran,Vancouver; Canada,Tue Jan 12 00:01:31 +0000 2010,The Managing Director of Metro Gnome Lawn and Garden in Vancouver; BC; Canada.  Recent UBC graduate with a B.A.; Philosophy / Political Science Combined major.
CoupzVancouver,Vancouver,Thu Nov 18 05:42:28 +0000 2010,We Search All The Top Daily Deal Sites  So You Can Save 50% to 90% Off Vancouver Deals. 
MCI_Vancouver,Vancouver; BC; Canada,Tue Aug 25 17:14:04 +0000 2009,MCI is an independent global association; communication and event management company. www.mci-group.com  
EthosStrategy,Metro Vancouver; BC Canada,Thu Apr 01 21:34:17 +0000 2010,Planning + Research + Communications - We provide meaningful and creative advice to public interest organizations. Tweets by Helesia
LorienHenson,Vancouver; BC,Mon Feb 04 02:49:17 +0000 2008,Activist for social good. Founder @PowerPlantVan + sustainable event biz @LimeLightEvents. Outdoor music festival fan; yogi; snowboarder; vegan 
FalseCreekFerry,Vancouver; Canada,Mon Dec 20 00:41:54 +0000 2010,The original little blue ferries of False Creek. Providing Vancouver & Granville Island with year-round commuter and sightseeing ferry service since 1982.
m_narula,,Mon Dec 27 10:45:07 +0000 2010,
me_owth,Vancity,Thu Aug 12 03:24:08 +0000 2010,A girl with a strange love for pink lipgloss; dim sum and all things shiny; starry and faux furry.
DUBOLLP,Vancouver;  BC,Thu Nov 04 22:58:53 +0000 2010,West Coast Lawyers since 1972.
ea_p,Vancouver; BC,Fri Nov 13 22:44:32 +0000 2009,campaigner; academic; baker and lover of dancing; singing; music fine wines; cheeses and scotch.
PowerPlantVan,Vancouver; BC,Wed Jul 08 02:17:46 +0000 2009,Green gathering for sustainability leaders; eco-adventurers + media activists. Rub shoulders; Share + Learn; Celebrate. Tweets by #PPVan founder @LorienHenson
LimeLightEvents,Vancouver; BC,Thu Oct 08 03:47:33 +0000 2009,Producing green events and experiential marketing campaigns for progressive brands that want to do the right thing. Tweets by co-founder @LorienHenson 
dwmah,Vancouver; BC,Fri Jan 15 18:33:08 +0000 2010,person. snowboarder. traveler. worker. communicator. wanderer. aspiring marketing and social media geek. -LiveLifeLove-
ItsRyanClayton,Vancouver; BC,Wed Dec 08 20:33:24 +0000 2010,Activist; Educator; Geek. Anti-bullying facilitator. Lifeguard. Changing the world one day at a time. I have four tattoos.
UBC_RMS,Vancouver; BC,Mon Dec 20 23:00:33 +0000 2010,The #UBC Department of Risk Management Services helps build a safe and environmentally responsible culture at the University of British Columbia.
OnWays2Pleasure,Vancouver; BC,Fri Mar 26 22:50:14 +0000 2010,Our Sex Toys & Sexy Gifts Boutique invites and wishes you lasting and loud O - Jee-s!!!
vanfleamarket,Vancouver ,Mon Feb 08 04:05:41 +0000 2010,
PJWDavidson,Vancouver BC,Sun Nov 07 17:01:05 +0000 2010,Communications/Blogger/Human-connector/Conservation-Ambassador/Volunteer/Canadian Guy
petermacrae,Vancouver; Canada,Sat Dec 11 00:31:12 +0000 2010,Intern Architect @Merrick Architecture. LEED green associate. 
vancouverkelvin,Vancouver,Thu Mar 12 09:48:36 +0000 2009,urban & community planning policy engagement development design architecture ambience technology sustainability conservation heritage culture mental-health food
jahutka,Vancouver; BC,Thu Jun 25 05:16:15 +0000 2009,Attempting to make sense and find harmony.  Not using Twitter for anything useful... yet.
CdnGamesConf,Vancouver; BC,Mon Oct 18 23:28:18 +0000 2010,The Canadian Games Conference (formerly GDC-Canada) is a two-day conference/exhibition held in Vancouver; BC; Canada on May 19-20th; 2011  http://ow.ly/3l2fv
Museumofvan,Vancouver,Wed May 27 17:56:35 +0000 2009,The latest exhibitions; happenings; local thinking at MOV. Tweets from Hanna in the audience engagement office & Amanda in communications.
kootenayborn,Vancouver; British Columbia,Tue Mar 24 16:52:56 +0000 2009,Husband and father. Collector of Coins & Watches. Blogger; Photographer; Marketer & East Vanner. Merch. Manager for London Drugs.
BC_VOTE,Vancouver; British Columbia,Thu Jun 11 16:13:49 +0000 2009,BC VOTE is a new nonpartisan political blog about the democratic process in British Columbia. Tweets by @StephenIrving; Managing Editor.   
vitaminSH,Vancouver; BC; Canada,Thu Nov 11 00:26:10 +0000 2010,BSc.|WT; BCRPA| Get your daily dose of real-life fitness; nutrition & wellness bytes by following me through my 2nd degree at UBC to RD (Registered Dietitian)!
hannerl,Vancouver; Canada,Wed Feb 18 22:08:16 +0000 2009,Human; interested in socio-cultural configurations in/of new media; cities; food. Erstwhile policy wonk. Curator of Engagement & Dialogue @MuseumofVan. 
InventFuture,British Columbia,Wed Jun 03 20:24:16 +0000 2009,Submit your energy conservation ideas to BC Hydro’s INVENT THE FUTURE contest for a chance to WIN! Over $15;000 in prizes. BC youth 16 - 24. Starts October 1st.
olusha,Vancouver,Sun Feb 08 19:46:11 +0000 2009,
nicksartore,Vancouver,Wed Feb 11 16:38:23 +0000 2009,Artistic Director of @SHIFTarts; Co-Host of the @CiTR_ArtsReport Wednesdays at 5pm on 101.9FM; a sometimes student; and general busy-body.
TravelodgeVic,Victoria; BC; Canada,Fri Oct 29 17:20:38 +0000 2010,Hotel in Victoria's Upper Harbour district; just a 5 minute drive from downtown Victoria. Indoor pool/saunas/fitness room; free parking and free wi-fi.
CKNWWeekendNews,Vancouver,Sat Sep 26 15:31:30 +0000 2009,
MetropolitanCC,Vancouver & Abbotsford; BC,Tue Sep 21 04:11:14 +0000 2010,A clear path to career & educational success; Metropolitan Community College offers courses that are accessible to learners from all social/cultural backgrounds
DueckGMDowntown,Downtown Vancouver,Tue Sep 28 21:41:33 +0000 2010,We sell cars! Whatever your looking for - we can get it. Direct message for more info.
Roselle_E,,Thu Apr 02 23:57:58 +0000 2009,
birdiehamilton,Vancouver,Mon Nov 30 03:31:19 +0000 2009,music+journalism+real estate/Vancouver
JimmyLeeLam,Vancouver,Sat Jun 12 04:37:47 +0000 2010,Interior Designer working at Linnea LLC (Canada) Architectural Elegant products for homes and spaces.
GreenVanpool,Metro Vancouver; Canada,Tue Sep 08 23:19:14 +0000 2009,Reduce single-occupant vehicles. Promote rideshare in Lower Mainland; British Columbia through Green Vanpool tweet program.
Hanstastik,Vancouver; BC; Canada,Thu Aug 27 17:09:48 +0000 2009,Helping the world in my own lil way by tweeting
TheRealDeanHill,Vancouver; BC,Thu Sep 23 23:41:53 +0000 2010,Join Dean Hill weekdays from 2pm to 7pm; only on Classic Rock 101.
thiscitylifeyvr,Vancouver; BC,Fri Oct 22 18:35:55 +0000 2010,Gov't PR/media advisor w/Masters in Urban Studies (tweets my own). Vancouver native. I love to play guitar & blog about cities: http://thiscitylife.tumblr.com 
Brookland_condo,Surrey; British Columbia,Thu Oct 28 22:51:21 +0000 2010,The Brookland condo development in Surrey - 1 and 2-bedroom homes for sale in a new real estate development in Surrey; BC
ConsumerProBC,British Columbia; Canada,Tue Aug 31 23:02:16 +0000 2010,We are here to help BC consumers and encourage a fair marketplace for business. We will happily share helpful information with you (no legal advice though!)
katiejeanes,Vancouver; British Columbia,Thu Jan 28 05:04:10 +0000 2010,Vagabond. Entrepreneur. Adventurer. Just trying to bring a little more good to the world. Founder of @alittlemoregood
hornjohnhorn,Vancouver; British Columbia,Mon Apr 20 07:26:49 +0000 2009,Career Educator; Professional Storyteller; Powerful Public Speaker; and Creative Blogger
sefalsecreek,False Creek; Vancouver; BC,Mon Jan 11 20:53:40 +0000 2010,Events + News in Southeast False Creek (including the Olympic Village) from @604homesguy (Royal LePage Westside). Also on Facebook http://fb.com/sefalsecreek.
murphybarb,Vancouver / The Maritimes,Thu May 21 01:38:08 +0000 2009,Graphic Designer; doing stuff; learning new stuff and getting stuff done.   http://murphybarb.com  
denisepraill,ÜT: 49.294989;-122.862203,Sun Nov 02 17:22:34 +0000 2008,Wife of one; mom to two gorgeous girls; fundraising/communications pro. Interested in philanthropy and politics. Most likely to follow local folks :)
RalphsRadio,Vancouver,Thu Jul 16 20:49:53 +0000 2009,Family business in Vancouver since 1949. Specializing in car audio; car security; wireless & satellite communications. www.ralphs.ca; www.ralphsblog.ca
maratooney,Vancouver,Fri Nov 19 21:14:59 +0000 2010,
ShiatsuQuay,North Vancouver BC Canada,Thu Dec 03 01:37:05 +0000 2009,
CaseIT,Vancouver; BC; Canada,Tue Jun 16 16:47:21 +0000 2009,North America's largest annual international undergraduate MIS case competition hosted by @SFUBeedie.     CaseIT 2012 will be held February 1-4; 2012. #CaseIT
ptorrevillas,Vancouver; Canada,Tue Sep 14 03:03:47 +0000 2010,Reporter/photographer for Metro News Vancouver. Got an idea to share? phylicia.torrevillas(at)metronews.ca. Views are my own.
NateOrganic,Vancouver; BC ,Sun Nov 07 00:15:23 +0000 2010,NATE organics is a trend setting; eco-forward; limited edition Men's clothing Line based in Vancouver BC
charterbuslines,Vancouver; BC; Canada,Sat Jun 12 00:44:53 +0000 2010,Charter Bus Lines is a full service motorcoach company specializing in local transportation in the Vancouver area as well as over-the-road charter trips.
_lizcraig,Vancouver; BC,Tue Nov 09 03:03:57 +0000 2010,newz hound.  
RetainMyTalents,Vancouver,Sat Dec 04 01:38:05 +0000 2010,Tech Savvy Sr. EA/AA seeks P/T career opps. in Vanc(dwntn pref) Res/BusDev; Mrktg; Dbase Mgmt;WP & DE 120WPM; Team Lead;Positive;Proactive & Engaged 
ParkBoard,Vancouver;  Canada,Sat Mar 28 22:57:23 +0000 2009,The Vancouver Park Board maintains over 220 parks and 40 major facilities.
FootSolutionsBC,Vancouver; BC,Thu Apr 30 17:00:32 +0000 2009,Christian Johannsen; Certified Pedorthist at Foot Solutions; Board Chair; Kitsilano Chamber of Commerce. Husband; Father of 2; Friend 2 many.
BeeVancity,Vancouver,Sat Nov 13 04:42:38 +0000 2010,Building; Engaging; & Empowering #Vancouver thru Honey Sweet #Events. Focus on #local #eco #justice. Tweets by @masalapuri @kimieong @steph_chua @asterix
buildingtester,,Mon Nov 29 03:58:21 +0000 2010,
dbutton,Vancouver,Tue Feb 17 23:09:21 +0000 2009,Marketer. Social butterfly. Wit. People connector.  PM for Good Money(tm) Impact Venture Challenge for @Vancity #GMIVC   http://j.mp/GMIVCt 
UBCRobsonSquare,Vancouver; BC,Mon Nov 01 19:36:50 +0000 2010,Located in the heart of Vancouver. Book your next event at UBC Robson Square! --------------------------------------------------------------------------------  
WolfgangPainter,Vancouver; BC,Sat Sep 26 20:22:34 +0000 2009,Wolfgang Commercial Painters: All You'll See Is The Difference
joezaccaria,Langley; BC,Sat Mar 14 18:37:47 +0000 2009,Small business owner and political junkie that loves to follow all levels of  politics & government; new urbanism; and transit options including Light Rail.
stephengillis,Vancouver; BC Canada,Thu Aug 20 04:31:41 +0000 2009,Filmmaker/T-shirt lover I tweet about my passions in life. Check out my films @twlthemovie; @solarmaasai; and my film co. @randompictures. 
alisachoi,Vancouver; BC; Canada,Mon Aug 16 06:43:39 +0000 2010,Cross-cultural business and marketing strategist; helping organizations build a culturally-diverse consumer and employee base. Member of the 1.5 & sandwich gen.
jeff_w32,Vancouver,Sat Jan 24 08:47:19 +0000 2009,Interaction Designer / Interactive Developer  / Coffee Enthusiast / Gamer / Movie Critic / Activist
nlamontagne,Vancouver - LA,Mon Feb 23 13:54:30 +0000 2009,City Planner / Urbanist / Student (PhD @ UCLA)  Fascinated by the many random things that makes cities interesting and wonderful places to be and live
ivancouverite,Vancouver,Wed May 20 17:34:31 +0000 2009,I; Vancouverite blogger; creative writer; editor; community manager; professional nerd and wordsmith.
emmapydee,Burnaby; BC,Tue Aug 04 18:04:15 +0000 2009,I have a crush on Vancouver; an undying love for hockey and an obsession with tea.
thinkcity,Vancouver,Fri Feb 06 02:14:48 +0000 2009,Bringing citizens together to find practical solutions to civic challenges.
StreamofDreams,Burnaby; BC; Canada,Wed Jun 09 22:56:11 +0000 2010,Educating schoolkids and communities about their watersheds; rivers and streams; while dazzling them with the charm of public art.
AimeeRita,Vancouver; BC,Tue Oct 06 23:11:45 +0000 2009,REM Master's Student/Toxicology/Budding planner/Local food advocate/Yoga enthusiast/ CAPS-ACEAU 2012 conference planning committee/  [ http://caps-aceau.org ] 
OrionIrvine,ÜT: 49.280908;-123.094203,Sat Mar 27 23:17:11 +0000 2010,
Complainerea,Vancouver; BC,Wed Apr 15 23:25:48 +0000 2009,i like to be vocal about things. I also love cocalising my thoughts when not happy. This is my venting process. Enjoy 
VanConstruction,Vancouver; BC; Canada,Wed Nov 24 20:50:52 +0000 2010,Assisting 700 general contractors; trades; manufacturers & suppliers in building their businesses. Tweets by President Keith Sashaw & @mccullochaudrey. 
paulcip,Burnaby; BC; Canada,Tue Dec 16 16:37:16 +0000 2008,Editor; writer; into photography; sustainability; streamkeeping; community.
snicoles,Canada,Sat Apr 26 16:35:23 +0000 2008,Vancouverite. Posts on urban; green; stories; secrets; foodie and friends-with-fur.
carbontalks,Vancouver; BC; Canada,Mon Nov 01 20:37:43 +0000 2010,Carbon Talks; based at SFU; promotes leadership; ideas; and dialogue on how to advance Canadian global competitiveness by shifting to a low carbon economy.
cdnkitcat,Vancouver; BC,Wed Jul 29 06:42:47 +0000 2009,Passionate about photography; market'n; explor'n; henna art. Music is always playing in the background of my life. 
greenglobetips,North Vancouver; BC,Thu Oct 14 22:22:33 +0000 2010,We are Vancouver's only Green Clean Institute certified company! Providing green cleaning services for your business and home. 
ecojackiejo,,Tue Nov 09 00:29:43 +0000 2010,livin' on purpose. dreamin' with passion. actin' on principle. tweetin' about the Arctic; sustainable tourism; community development; & stories that inspire
islandbritt,Vancouver; BC,Wed Sep 08 23:08:07 +0000 2010,
UrbanSnapshot,Vancouver,Tue Nov 09 05:46:16 +0000 2010,Urban-Snapshot - A snapshot of your community! Urban-Snapshot puts a spotlight on interesting people and places in Vanouver. Get to know your neighbourhood!
VancouverJock,North Vancouver,Thu Oct 21 21:16:09 +0000 2010,Sport; health & fitness kinda guy. Soccer; tennis; running; kickboxing; I love it all.I practice Thai yoga massage 7783841810
CiTRradio,Vancouver; BC; Canada,Tue Nov 18 00:52:05 +0000 2008,I'm an independent radio station in Vancouver; BC; Canada. Listen at 101.9 FM or www.citr.ca.
_conniewan,,Thu Mar 11 08:38:45 +0000 2010,
saltspringsspa,Salt Spring Island; BC; Canada,Tue Sep 22 16:11:51 +0000 2009,Health Resort & Spa Featuring Mineral Springs; Ayurvedic Medicine; Fireplaces; BBQs; Row Boats; Bicycles; and Hiking near Vancouver; British Columbia; Canada.
Vancouver_Adam,Vancouver,Sat Apr 11 18:58:14 +0000 2009,Transportation professional; cycling advocate; urban critic and future developer.   Never stop riding.
WorkSafeBC,Richmond; BC,Mon Apr 23 16:56:04 +0000 2007,Working to make a difference in workplace health and safety.
kalyeena,Vancouver; B.C.,Sun Jan 25 06:24:12 +0000 2009,News Editor for The Ubyssey — UBC's official student newspaper. 
ABPBC,Vancouver; BC,Thu Feb 04 23:07:49 +0000 2010,The Association of Book Publishers of BC works to support the long-term health and success of the Canadian-owned book industry in British Columbia.
soundtherapyrad,Vancouver; BC,Wed Dec 23 20:22:06 +0000 2009,Sound Therapy delves into the intricate world of the creative mind; interweaving great music; lively guest interviews and insightful discussion.
FreyjaRealEstat,Vancouver; BC,Sun May 30 02:11:13 +0000 2010,REBGV - Van East Division Director; Pres. Valkeries Mines; REALTOR® - Royal Pacific; CI - NLCC MJ Miller 78 soon 2 b A/SLT; mom 2 Hockey All Star
bluegreenclean,Vancouver,Sun Jun 20 17:55:58 +0000 2010,An eco-friendly cleaning company. Offering residential; commercial & construction cleaning.
lee_crl,Vancouver; Canada,Mon May 25 18:25:27 +0000 2009,psychologist; acupuncturist; herbalist; doctor in a healing process; doodler; dreamer; crystallographer; energy juggler; card collector; alchemist; cat sleeper
ICareSandra,Vancouver,Fri May 09 18:45:01 +0000 2008,Environmental Issues - People with Disabilities - Gardening - Arts & Crafts - Politics - Autism - Sustainability - Community Development - Earth Religions
BCVCPeaceArch,Surrey BC; Canada,Tue Nov 16 17:11:34 +0000 2010,Tourism info; discounted attraction tix; hotel reservations & transportation for Vancouver & BC.  Located north of the Peace Arch border. Tweets by Meghan
Saferway,Victoria; BC,Thu Jul 29 17:29:03 +0000 2010,We are a full service driver training school offering programs for new; or upgrading drivers. They include car; motorcycle; truck; air brake; instructor.     
steph_chua,Vancouver; Canada,Tue Apr 28 20:20:26 +0000 2009,
VancityBuzz,Vancouver,Wed Jan 21 23:33:01 +0000 2009,Editor of Vancity Buzz. Blogger by day; Ninja by night and Canucks fan all the time.
BrendaLindal,VANCOUVER; British Columbia,Thu Oct 02 20:45:36 +0000 2008,Visual expression is an amazing thing. 
InkTonerDepot,North Vancouver,Fri Sep 25 02:39:55 +0000 2009,Spend Less;Print More;Preserve The Environment
bifnaked,Vancouver,Wed Oct 08 03:20:53 +0000 2008,International Recording Artist; Speaker; Lecturer; Advocate; Activist; Straight-Edger; Vegan; and TroubleMaker. 
EPIC_Expo,Vancouver; BC; Canada,Fri Aug 21 15:42:16 +0000 2009,May 11-13; 2012 at the Vancouver Convention Centre. #epicexpo
dhollick,Vancouver; Canada,Wed Dec 17 04:15:36 +0000 2008,Writer; entrepreneur; photographer; and Nomadic renaissance man! I've travelled to 28 different countries; sailed the seven seas; and can cook a mean stir fry.
VancouversDeals,Vancouver; British Columbia,Fri Aug 13 04:55:18 +0000 2010,Be the first to know about Vancouver's best and hottest deals; sales; coupons; freebies; specials; promotions and discounts.
BestHomesBC,Vancouver,Thu Dec 18 22:57:07 +0000 2008,Weekly property column in the Vancouver Sun; 'Sold (Bought)'; and real estate marketing through BestHomesBC.com and AssignmentsCanada.ca
randomcouture,Vancouver; BC Canada,Sat Apr 24 20:42:41 +0000 2010,A young Liv Tyler raised by Tim Burton.
SamsungHTC,vancouver,Sat Apr 25 02:56:41 +0000 2009,I like downtown vancouver; i like to eat drink jugo juice; i like to have fun at the beach.
Vasensa_YVR,Vancouver; B.C.,Thu Nov 04 23:39:27 +0000 2010,The best photos of Vancouver plus your source for Vancouver community events; attractions; and photo-products!  
penumbradesign,North Vancouver; BC,Mon May 17 01:48:18 +0000 2010,Residential design that transforms personal stories into unique living spaces through architecture
SusanThomas2011,Surrey BC Canada,Wed Feb 17 02:26:09 +0000 2010,Susan Thomas//compassionate & committed voice for Surrey with a heart for the community. Ran for Surrey City Council Nov 19 2011. Loves Surrey
ericafromcanada,Brisbane; Australia,Sun Dec 28 16:22:33 +0000 2008,John Hughes film enthusiast and UBC Vancouver student on exchange at the University of Queensland.
TomTheCarGuy,Vancouver. BC,Wed Feb 17 06:00:04 +0000 2010,Ooh shiny! Follow me for news on all things shiny; like cars; tech; glitz; & glam; plus random things I found funny. Oh and I sell cars too!
VanLookout,Vancouver; BC; Canada,Mon Nov 16 23:51:58 +0000 2009,Located in the heart of downtown Vancouver; our iconic landmark offers unparalleled 360º views of the city and beyond! Must see attraction and the perfect venue
janeter_,Vancouver & Richmond; BC,Sat Sep 11 07:18:54 +0000 2010,Food; yoga; leisurely bike rides and sunshine keeps me happy.
tantwy,Victoria; BC,Sat Sep 12 23:48:40 +0000 2009,Passionate about my son; #bcgov; #citizenengagement; #socialmedia; toronto blue #jays. As a personal mission improving the #education system for all kids.
KitsChamber,Vancouver Westside,Sun Jun 28 05:25:41 +0000 2009,Get your tickets for the  Westside Business Awards: http://ow.ly/7C1w0 | The Kitsilano Chamber of Commerce: Voice of Vancouver Small Business.
Dirt_Merchant,Vancouver; BC,Tue Apr 13 21:33:06 +0000 2010,Sales & Marketing Professional - Construction Materials 
TownShift,Surrey,Fri Oct 29 20:54:06 +0000 2010,TownShift: Suburb into City  An Ideas Competition for Surrey's Town Centres
CivicJobs,Canada,Wed Mar 11 20:49:29 +0000 2009,Canada's largest online source of local government jobs. Visit us today at www.civicjobs.ca.
justjoice,Vancouver; BC,Wed Feb 18 02:11:08 +0000 2009,It's done son!
pembina,Canada,Tue Mar 17 17:02:22 +0000 2009,News and updates from the Pembina Institute; a Canadian non-profit think tank advancing innovative sustainable energy solutions.
missrachelha,Kingston; Canada,Fri Feb 19 03:57:16 +0000 2010,Bachelor of Commerce '14; Queen's School of Business.  
masalapuri,Vancouver,Sat Sep 19 01:42:44 +0000 2009,Communications & Engagement Leader at @bcpsqc. Founder of @beevancity @eastvanlove @coopculture @rangichangi @ehrcn. Tweets are of my own; not my organizations.
Rezvia,Vancouver; BC,Mon Nov 16 20:30:57 +0000 2009,Rezvia is your #1 source for Vancouver; Victoria and Nanaimo Hotels; Attractions and Events! 1-866-4-REZVIA Book your hotel with us!   
BCFerries,British Columbia,Thu Apr 15 21:04:23 +0000 2010,Your official Twitter source for BC Ferries news and announcements. 
marpolevillage,Vancouver,Sat Oct 16 14:52:19 +0000 2010,Marpole Village: The friendly neighbourhood commercial district for all of your daily shopping needs; on the deep south Granville of Vancouver.
PrimusTutors,Vancouver,Tue Oct 05 23:54:58 +0000 2010,Vancouver-based tutoring services agency. We pick the best tutors for our students! K-12; all subjects. Piano and music theory lessons; RCM prep. 
UFWcoquitlam,1101 United Blvd. Coquitlam BC,Tue Oct 26 03:27:29 +0000 2010,United Furniture Warehouse is committed to offering home furnishing solutions to fit anyone's budget by carrying good quality; brand name furniture at prices...
VancouverSEM,Vancouver; BC,Wed Sep 15 18:42:35 +0000 2010,We help clients gain a competitive advantage in attracting; recruiting and retaining the highest quality workforce.
unionwill,Canada,Sun Sep 07 20:03:04 +0000 2008,Lifelong North Vanner. Proud CUPE member and proud New Democrat.
JournalismJunki,Coquitlam; B.C.,Fri Mar 06 20:22:51 +0000 2009,
